coolbest2011,1,祝两位2字头小朋友生日快乐 一位已婚一位单身 硬凑一对 ​​​
coolbest2011,8,【嗯哼最喜欢妈妈 妈妈是最美的】《爸爸去哪儿5》之《爸爸带娃记》杜江、嗯哼聊天 嗯哼：为什么我会那么乖呢？[笑而不语]杜江：泡芙、山竹、neinei你最喜欢谁？嗯哼：小山竹。杜江：是这样回答的吗？妈妈怎么教你的啊。重新问一遍哦。山竹、泡芙、neinei你最喜欢谁？嗯哼：妈妈。杜江：那妈妈爸爸 ​​​ 全文【严顺开老师一路走好！他塑造的阿Q令人难忘】今天有媒体称著名演员严顺开去世，享年80岁。记者已跟上海滑稽剧团核实此消息，目前追悼会时间尚未确定。严顺开毕业于中央戏剧学院表演系，1981年初登银幕，主演剧情电影《阿Q正传》，凭借该片获第6届大众电影百花奖最佳男演员奖和第2届韦维国际喜剧电影节 ​​​ 全文想跟守在我家外面的记者大哥说一声…您从机场开始跟就发现您啦 刚上楼的时候您还出来冒头我也看到您啦[并不简单]您就别在家外面等着了 北京天冷 我就算出去我也没得拍 啥料都爆不出 也不希望家人受到影响～赶紧回家休息吧～大家都不容易～互相理解～[太开心][太开心][太开心] ​​​抱歉，此微博已被作者删除。查看帮助：http://t.cn/Rfd3rQV#l.i.k.egirls出道#顶一个，关注下likegirls。挺棒的几个人顶一个，关注下likegirls。 ​​​抱歉，此微博已被作者删除。查看帮助：http://t.cn/Rfd3rQV#马天宇天赐美颜#嗯，我天赐哥哥欺负小樱空释的桥段，真的炒鸡帅呀！大樱空释欺负小樱空释哈哈 马天宇天赐美颜这次是真的火了，挡不住！马天宇天赐美颜 马天赐真的是帅出新高度呀！ 其实我觉得最后释和霰雪水仙也是挺好的结局[可爱] 马天宇天赐美颜爱或者不爱其实都没必要再问总归你我没在一 ​​​[失望][bm彩色][bm咧嘴]#入梦师今日觉醒#曾经有一位特别喜欢看站在你的面前，现在又有了特别喜欢看特别喜欢看zx特别喜欢看入梦师这个电影真不错 ​​​#约吧大明星#爽歪歪，约吧大明星好受欢迎哈，爽歪歪！这个综艺我挺喜欢的凑个热闹啦~~~~~呵呵呵喜欢他们萌萌的样子这个综艺我挺喜欢的 ​​​#活出真我华晨宇#[bm抬腿][悲伤]非常的认可了，希望华晨宇越来越出色，绝对的。[愚人节] ​​​#我在石象湖花海做瑜伽#[神马][话筒][囧][大耳兔]赞赞赞！！感觉石象湖花海就是让人比较的令人心动，好棒~~吼吼。 ​​​来一波易烊千玺的表情包[心][心][心] ​​​抱歉，此微博已被作者删除。查看帮助：http://t.cn/Rfd3rQV抱歉，此微博已被作者删除。查看帮助：http://t.cn/Rfd3rQV
陈野鬼6104743892,11,"哈哈！！！目标明确 ​​​这一年又快过完了！ ​​​分享图片 ​​​各位：         于新春佳节到来之际，鄙人遥祝各位新春愉快，阖家欢乐，万事如意！                                                        陈   敬上                           （由于人多就不一一发） 咸阳·长武县 ​​​经商须学胡雪岩做人当如杜月笙 咸阳·长武县 ​​​#咸阳身边事# 【替老伴打扫卫生捡5090元 咸阳66岁老人联系银行找失主】自己没有工作，做环卫工的老伴月收入只有1680元，看到地上有人遗失的5000多元现金，66岁的杜宗友丝毫没动心，而是通过银行联系到了失主，原封不动还给对方。　　杜宗友是咸阳市渭城区北杜街办人，自己没有工作。最近，在咸阳火车 ​​​ 全文吃不 ​​​关于周立波被捕之我再说             周韶光        当听到周立波在美国被捕之事时，我的第六感官立即有一种预感，事件的真相恐怕不是报道所说的非法持有枪支、非法持有毒品以及危险驾驶那么简单，因为我注意到了一同被捕的另一个叫唐爽的人。对美国佬的作派，我不说有研究，但因为看多了，多少能 ​​​ 全文七岁的小外甥酒喝的满客厅唱葫芦娃！真是醉了！！！ ​​​馬上就要過年了～他们不会网上订票，更不能托关系买票 ，为了一张回家的票他们要排上几个小时 ，才是一张站票 ，才能一年回一次老家。请别用厌恶的眼光对待他们，请协助他们买票，让他们回家团圆。请转发给更多人，积累公德，拒绝冷漠。[心][心][心] ​​​#咸阳身边事# 【旬邑一村委会拖欠工程款大门被锁镇政府称：与我没关系】四年前，彬县农民巩万鹏垫资39万多元，为旬邑县底庙镇于家庄村修缮了村委会办公室及场地;可是，四年时间过去了，巩万鹏只领到了其中的14万元旬邑一村委会拖欠工程款大门被锁& 镇政府称：与我没关系 ​​​#周立波被捕# ​​​【两部委回应娃哈哈缴500多种费：实为:212】娃哈哈集团反映缴纳500多种费，财政部、国家发展改革委公布，经过核实2015年该集团有支出数据实际缴费项目为317项，与企业提供缴费项目相差216项。剔除重复计算后该集团及所属企业实际缴费项目为212项。两部委回应“娃哈哈缴500多种费” 实为212项 ​​​【2016年陕西“蓝天成绩单”出炉：商洛最优[阳光]】1月17日，陕西省环境保护厅向媒体发布了2016年12月和2016年全年各城市空气质量。根据中国环境监测总站和省环境监测中心站核算结果，商洛市收获了310个蓝天，比去年多了4天，为全省空气最好的城市。关中地区空气质量最好的为宝鸡市，收获了239个蓝天， ​​​ 全文“迪拜游毁一生，旧版美钞变成假币，93年女孩被扣迪拜生不如死”后续二。原帖图二图三。（原帖传送门：http://t.cn/RM1Iama ） ​​​名下3000平米的商铺，全款房子4套有按揭房1套，公司注册资金2200万，1996年成立做消防的，名下车产，路虎揽胜一台270万，保时捷帕拉梅拉一台140万，奔驰S500一台220万，路虎发现4一台100多万我可怜的任总穷的靠抵押家产来过年！ ​​​跑去看戏结果！散场了！这天！！！ ​​​【康师傅编码泄露致乐视会员被0.8元抛售 回应称正在调查】原本官方售价为15元的乐视包月会员，竟然在黑市可以0.8元低价获得，目前流入黑市的乐视会员已经超过了10万个，而这些流入黑市的低价会员兑换码被曝泄露于康师傅产品编码。编码泄露致乐视会员被抛售 ​​​想吃包子了[馋嘴][馋嘴][馋嘴] ​​​拍视频的咋这么能装哔～捏[下][污]#新年乐不停# 秒拍视频 . ​​​慢慢的老去！！！ ​​​无聊的杰作！！！ ​​​曾经的记忆 ​​​#别让骗子给你拜年#来看看这个话题 别让骗子给你拜年 ​​​【樊记腊汁猪蹄检出""瘦肉精"" 厂家称问题产品已召回】1月13日，省食药监局通告显示，抽检12类147批次食品样品，合格样品142批次，不合格样品5批次，樊记腊汁猪蹄猪耳检出“瘦肉精”。　　腊汁猪蹄猪耳检出非法兽药　　不合格样品所涉及的标称企业、产品和不合格指标为：　　西安市大华餐饮有限责任公 ​​​ 全文#咸阳生活#2017年1月17日8点主要城市空气污染排行：咸阳393，西安353[黑线][黑线] ​​​抱歉，此微博已被作者删除。查看帮助：http://t.cn/Rfd3rQV回家几天每天都能听见买板板糖的声音 咸阳·长武县 ​​​自古多情空余恨曾经沧海难为水， 咸阳·长武县 ​​​2016年1月7日，@曹国伟 先生倡导的#星光公益联盟# 正式启动。一年来，1100多位明星携手3亿微博爱心用户，共同创造了654亿公益话题阅读量的暖心历史。2017年1月16日，#微博之夜# 将再次拉开序幕，@星光公益联盟 重温年度热点，传递无限影响力。以微博之力，让世界更美！星光公益联盟 ​​​醉卧美人膝，醒掌天下权。 ​​​君天地君亲师君并与天地君立与天地已食三七载自立农业国学识断数载漂泊已十秋返乡过四夏欲创不朽业怎耐多坎坷初返两年间如日与中天偶遇些阻碍如履如平地初创两年间基地布五省产品走遍国实资以亿计岂料遇寒冬因为君无能御驾其不力重情而无义重信于小人遭此其困顿重振而无力 ​​​ 全文十年生死两茫茫！ ​​​"
淡了沫了,2,"快被它给整哭了T﹏T ​​​酝酿一晚上的睡意   翻来覆去就是睡不着[泪][泪] ​​​放假比上班都累[二哈] ​​​这篇英语作文很强势[笑cry]，书面表达满分[笑cry] ​​​​奥利奥居然出了中秋节月饼！！艾特列表第一位让他给你买..... ​​​让我坚持下去的  不是什么宏大的理想  而是赚好多好多钱  然后买买买 ​​​人生就是一场自己与自己的较量：我们要做的，无非就是让积极打败消极，让快乐打败忧郁，让勤奋打败懒惰，让坚强打败脆弱。亲爱的，其实你真的很好，只是你还不知道。在每一个充满希望的清晨，告诉自己：努力，就能遇见更好的自己！ ​​​笑多了  以至于亢奋到现在[二哈][二哈]明天还能起得来吗 ​​​不要太在意别人的感受  不要别人一失落 你就紧张  不要别人一道歉 你就心软  不要总是让别人开心 自己委屈  不要让自己累得喘不过气   你过于敏感 且过于善良  而过于善良的人 最后都会吃亏 ​​​​感觉把一整年的数字都默写一遍[二哈][二哈] ​​​这天气已经热到不光流汗，还流油[二哈][二哈] ​​​韩国雪冰的新品“水蜜桃雪冰”今天就正式上市啦~饱满的桃肉覆盖着柔软的芝士蛋糕和冰凉的酸奶冰激凌~~今天的行程，加上雪冰吧！！[憧憬] ​​​【重庆3天三夜美食攻略】这是一篇关于重庆旅游的精华帖，包涵交通、美景和详细的美食介绍，想去重庆的朋友千万不要错过！cr：柳源的日記本 ​​​​如果将来你不娶我我就找一个跟你同姓的嫁了生个孩子就叫你的名字做不了你的新娘那就做你妈[二哈] ​​​​每当我想存钱的时候，总有个声音在说，""对自己好点""[允悲] ​​​#今日微信热点# 【微信转错账怎么办？这个功能很多人不知道，一招教你挽回损失！】使用微信转账时，如果转错账，想要拿回钱没这么简单。小编分享一个大招，让你防患于未然，甚至能够及时挽回损失，只要点击一个键就行了！详细操作☞微信转错账怎么办？这个功能很多人不知道，一招教你挽回损失！ ​​​小学生神作文之《我眼中的荆轲》，感觉逃不了一顿打了[允悲] ​​​​#搞笑# ​​​""做一个淡淡的女子 不浮不躁 不争不抢 不去计较浮华之事 不是不追求 只是不去强求 淡然地过着自己的生活 不要轰轰烈烈 只求安安心心"" ​​​毕业几年后才发现，最难忘的还是又穷又傻逼的大学时光 。 ​​​​[心] ​​​还不是因为穷[允悲][允悲][允悲] ​​​每天都要循环经历三件痛苦的事：睡不着，起不来，后悔睡太晚。 ​​​今天又无脑到用微信支付了一顿早餐[允悲][允悲][允悲] ​​​短短几天黑上加黑[允悲][允悲] ​​​90后处在一个尴尬的年龄，你是吗？[doge] ​​​""假如可以选择生活 我宁愿简简单单 一个茶杯 一间茅屋 一亩良田 一亿存款"" ​​​​【椰丝小方】非常可口的小甜点，喜欢的感觉学起来[赞] .  秒拍视频 ​​​“以前睡不着是单纯的睡多了  现在睡不着是因为环境  因为人 因为事  因为烦恼” ​​​​在午饭的点上吃早饭[伤心]，只想睡会缓缓 ​​​一句话形容你的大学食堂？毕业了才发现，大学食堂的味道是用来怀念的！  #小婊渣的日常# ​​​“有没有一瞬间  你觉得你什么都不是  每天只剩四种感觉  困饿累烦” ​ ​​​​有个吃货朋友是一种什么样的体验？[哈哈][哈哈] ​​​明天又是新的一天，晚安[兔子][兔子] ​​​清脆爽口的腌糖醋萝卜片！来上一碟酸甜脆嫩，再配上一碗粥享用，简直绝了！[兔子] ​​​让小可爱#民国#来治愈你忧桑的芯芯吧~[爱你] [爱你] [爱你] ​​​别看了，就说你呢。[微笑] ​​​还是不太放心出门在外的你 ​​​世界上最难做到的几件事：减肥 早睡 早起 让喜欢的人也喜欢自己 ​​​好牛逼的技能，卧槽，碉堡了，这个你绝对用的上！！！http://t.cn/RJZr8Wc ​​​史上最强换被套方法，只要不到1分钟，卧槽，碉堡了，建议留着备用！！秒拍视频 ​​​脾气好的人容易胖，因为他们把很多气话都吞进肚子里，结果又不太好消化。 ​ ​​​​"
小兔子姐姐最棒,7,"我在闲鱼卖·欧舒丹护手霜#来闲鱼，发现更多闲置超值好物#http://t.cn/RONEdrY ​​​pony化妆经验技巧大分享：从底妆、修容、眉毛、双眼皮、睫毛、唇妆、腮红、发型上做点小心思，比别人更细致更美[心] ​​​​彩妆TOP5排行榜 ​ ​​​​最实用的化妆教程，一整套妆容详细讲解 ​​​说说你用过后恨不得安利全世界的化妆品 ​​​​哪些护肤品性价比高，值得一试？ ​ ​​​怎么卸妆才能避免肤色暗沉，毛孔堵塞呢？ ​​​​24个聚会必玩小游戏太少了，我有30个！拒绝无聊玩手机尴尬[来][来] ​​​迟早有人为你披上婚纱 说着余生请多指教[戒指] ​​​关注我，这样穿更显瘦[来] ​​​[星光]少女心APP合集[星光]小仙女一定会喜欢哒[好喜欢]随手拍拍都能修出粉粉的感觉，我就是仙女本人了！[污] ​​​【70款面膜推荐大合集】什么面膜补水，什么面膜美白，什么面膜清洁功能好，这些你都知道吗？[兔子] ​​​​ 当下热门面膜哪款才最适合你？ ​​​【种草24套水乳】总有一款适合你 ​​​​[亲亲] ​​​​【洁面功课】如何根据自己的肤质选择适合自己的洗面奶？24款氨基酸和皂基洁面 总有一款适合你的 ​​​[星光]少女心APP合集[星光]小仙女一定会喜欢哒[好喜欢]随手拍拍都能修出粉粉的感觉，我就是仙女本人了！[污] ​​​[蝴蝶结]适合少女の香水合集[蝴蝶结]你人生中的第一瓶香水是什么？ ​​​5种肤质亲测12款粉底，谁是亲妈谁是渣！ ​​​​最适合秋冬的奶茶色、梅子色、砖红色口红 ​​​我就是靠这个妆撩到男友的，建议你也可以学一下~@潮美妆师 ​​​适合秋冬用的粉底液功课，话说雅诗兰黛那款简直油皮亲妈[二哈] ​​​给家里添一笔文艺的墨绿。 ​​​小兔子的美妆店, 日韩美妆代购，正品保证，价格美丽http://t.cn/RNedQHV ​​​小兔子的美妆店 日韩美妆代购，正品保证，价格美丽http://t.cn/RNedQHV ​​​我在微店发现一个好东西，快来看看吧http://t.cn/RNgjMau ​​​怡尛兔在小红书app分享了很多好东西，快来看看吧！（想看更多？下载@小红书 APP:应用详情）http://t.cn/RNnJZTY ​​​帮转，活动真实有效 评论抽一名送迪奥唇膏一支 转起来了@DIY设计家居馆 @DIY设计家居馆 @蓝朋友蓝星 @女神优衣库 @白菜分享君 @时尚一姐 @种草囤货达人 @DIY设计家居馆 @秀购网 @白菜萌萌主 @种草囤货达人 @蓝朋友蓝星 @时尚一姐 @少女信片 @穿搭师梁喵喵iam_m @败家小队长 @电影建军大业 @淘宝  ​​​ 全文无论你学什么专业，都应该了解的名词！！！[赞] ​​​开学季，第二波~  [憧憬] 100片！100片！100片！约一人！你准备好了嘛 ? 快戳图5 [心] ​​​看见此图30s内转走，七夕会被喜欢的人表白🍬[心] ​​​​铛铛铛，七夕到！折姐又来送礼物啦！╮(￣▽￣)╭ 【关注@打折情报员_ +转发】这条微博就有机会获得礼物哦(～￣▽￣)～ 拍立得相机  抽[1]名魔吻巧克力  抽[1]名火烈鸟抱枕  抽[2]名8月25日15点整 由@微博抽奖平台 开奖据说点赞的运气更加好哦~~ ​​​最近囤货的#面膜# Ray的面膜不要太好用了。一盒10片装。看了小红书，金装一盒88块吧，性价比也极高。真的比肌美精，高丝，可莱丝，春雨，snp等等好用太多了。[星星]金装：修复痘痘，痘印，提拉紧致、淡斑、红血丝、提亮肤色。[星星]银装：清洁补水、嫩肤抗皱、收缩毛孔、提亮肤色。[星星]特点：薄透贴合度 ​​​ 全文你对化妆牌子了解多少？来看看这些化妆品品牌之间的关系~ ​​​​生命中有一种爱，是安静的，欣赏是一种享受，是一种实实在在的享受。 ​​​如果广场舞都是她们这样的，你还觉得吵吗？ 内涵笑到家的秒拍视频 ​​​抽223人送：冰箱！空调！iphone红色7p！香水！项链！100多只口红！还有……不说了（我心痛），你们自己看图吧，全是大牌，但是给大家送福腻就是要“豪”无人性！@种草囤货达人 @微博抽奖平台  ​​​​一生必备的旅游清单，你想和谁一起去 ​​​​任何一个人离开你，都并非突然作的决定。人心是慢慢变冷，树叶是渐渐变黄，故事是缓缓写到结局。而爱，是因为失望太多，才变成不爱。 ​​​看完这篇好像又省了一大笔钱呢[笑而不语]好用的评价护肤品~· ​​​世界名著里最经典的100句话。你最喜欢哪一句？ ​​​​一组完全整理的PS快捷键，还不赶快收了！ ​ ​​​​"
爱吃肉的悦悦呀,4,制定食谱让我怀疑人生，来组抹茶动图吧[爱你][爱你] ​​​弟弟狰狞脸[笑cry][笑cry] ​​​我决定我要一心一意喜欢彭于晏 ​​​【你好，#十九大#】今天，中国共产党第十九次全国代表大会召开。“人民对美好生活的向往，就是我们的奋斗目标。”这是对人民的深情表白，也是对中国未来的庄严承诺。不忘初心，继续前进。你好，十九大；加油，中国！ ​​​Jasper吃火龙果 Jasper 波浪眉 《爸爸去哪儿5》小吃货Jasper吃个火龙果竟然吃出了梁朝伟同款“腊肠嘴”[哈哈]被发现后，还很要面子的担心自己上镜形象[笑cry] ​Jasper：要不要吃，好好吃，要不要？小泡芙：我要先回去跟爸爸一起吃Jasper：嗯，好好吃啊~真的要吃发现自己吃得满脸都是Jasper：我的 ​​​ 全文[泪][泪][泪][泪] ​​​搜王嘉尔小时候找到的对比图仔细体会这些小表情，说明什么“纵使生活捶打我，迫使我暴风成长，但我依然要是最初的模样”。试问我做不到，我早就不可爱了。所以你特别珍贵。@王嘉尔 #papillon# ​​​“嘉尔学长，这道题我不会做，你可以来我房间教我一下吗？” ​​​#2048明星魅力pk赛# Duang！魔饭生10月应援福利活动出炉啦！10月16日在魔饭生app玩2048游戏对战，为偶像赢得高大上的应援资源，还有机会获得iPhone 8 Plus哟[笑而不语]先来撒一波福利： 10月12日15:30-10月14日11:00期间转发本条微博将获得以下奖励： 热转第一名：App开机屏X1天; 热转第二名：App轮播 ​​​ 全文陈小春揪jasper的耳朵，jasper笑得超可爱...好像大耳朵图图！！[憧憬] ​​​庆祝百万粉&国庆中秋双节粉丝福利[心]！！！ 20万多！！20万多！！20万多抽9930人！！转发本条微博并关注@白菜坑 ＋@白菜买买菌 ＋@M大肉 10月13日抽30个5000元（单次现金抽奖的极限了啊啊啊啊啊）！！！！10月2日-10月12日每天抽900个5.2元所有均由@微博抽奖平台 抽出拿出了老婆本.你们不转发. ​​​ 全文嘎嘎INS更新啦，QQ音乐竟然没有版权，听不到怎么办[哼][哼] ​​​#王嘉尔Jackson# 小烟嗓也太好听了！每一帧都帅到飞起~~快来给嘎嘎@王嘉尔 打call吧 [憧憬][憧憬] ​​​[星光]cindy&Nick 仙蒂妮卡 哑光唇膏笔＋眼影[礼物]转+关+赞 10.24.平台揪一位[得]这6支[口红]！这套颜色很妙，低饱和度的珊瑚粉橘、橘棕、紫调豆沙、牛血紫红、吃土棕黄以及红棕色，基本上秋冬想要的颜色都在这一套里了！哑光但不完全雾面，带有微光泽，顺滑好涂。眼影是之前入的8色05号砖红盘，实用的 ​​​ 全文阚清子 纪凌尘在《亲爱的客栈》中的日常：喂食拍照互怼吵架生气和好. 阚清子有一千个生气的理由 纪凌尘就有一万种哄她的方法 清尘cp真是甜齁了 ♡ ​​​#夏目友人帐# 啊啊啊啊啊夏目友人帐剧场动版画制作决定！！！！2018年公开上映！！！有生之年啊啊啊啊！！ ​​​我的眼里只有你[并不简单][并不简单] ​​​弟弟在削芒果，妈妈问他干嘛，弟弟笑笑不说话，我猜说带给女朋友的，妈妈说这么小就知道心疼人了嘛，遗传谁呢，我去，吃了把狗粮 ​​​一个大男生没有腋毛，哈哈哈哈哈，弟弟说我长了，就是没怎么长出来，哈哈哈哈哈哈哈 爱吃肉的悦悦呀的秒拍视频 ​​​我正在申请微博认证，认证信息为“娱乐 博主”。请@现货白银黄金原油博弈-大师 @紫罗兰的等待ce @劝史贞良劝新 @草莓布丁酱i @石野桌回 @百勋股唤 转发此条微博帮我确认身份，多谢！！ 申请微博认证 ​​​来个嘉尔哥哥版的当年情~@王嘉尔 嘉两片芝士的秒拍视频 ​​​看到这样的王嘉尔 你会心疼么？看到每次受伤带病还在坚持的他 你会心疼么？他心存感恩 对每个人 对每件事 对每个行程 他都报以感恩之心 他知道 一切来之不易 所以 珍惜！个人行程是自己跑的 伤痛是自己承受的 资源是自己争取的 人脉是自己一点点积攒的！他的成功不是偶然！他努力 他坚持 他妥协  ​​​ 全文分享图片 ​​​http://t.cn/R0BrT0B ​​​@王嘉尔 @王嘉尔  [爱你][爱你][爱你] 南京·诺丁牛排(马鞍山万达店) ​​​台湾腔速成教学…是怎样啦…你造吗…酱紫喔…有像诶…没在怕的…而且我跟你讲厚…亏很大捏…一整个被你打败了啦…有够赞…真假…都嘛你在讲啦…全台最夯…超扯的…正诶…你很机车耶…就还好啦…这个我超哈的…靠腰…歹势…骗肖咧…救郎喔…你很奇怪耶…是不是跟念了一遍啦… ​​​祖国 生日快乐 ​​​#小怪兽出没# ​​​一回家就是去维利康买我喜欢的提拉米苏，吃的不要太快 ​​​[挤眼][挤眼][挤眼] ​​​分享视频 爱吃肉的悦悦呀的秒拍视频 ​​​模仿陈意涵穿梭大赛，哈哈哈哈哈哈这简直是模仿界的泥石流[允悲]一定要看到最后，哈哈哈哈哈哈笑到昏古七！！[笑cry] 趣闻搞笑的微博视频 ​​​【Jasper 小山竹】《爸爸去哪儿5》之《爸爸带娃记》当Jasper的小奶音遇上小山竹的东北话，俩人一起玩沙子的画面太可爱了！[允悲]一旁的陈小春、邓伦爸爸一直安静的看着~[偷笑]小山竹：我是沈阳滴，我是小山竹。你叫什么名字呀？Jasper：我叫陈胤捷。小山竹：咱俩一起玩好不好？Jasper：好！小山竹 ​​​ 全文7 for 7.7个月了就快来了[emoji]#王嘉尔##GOT7##等了7个月##7for7# ​​​王嘉尔朗读英文诗歌，叶芝 —《当你老了》，来体会下性感的小烟嗓吧～http://t.cn/R0br09N 学点英语口语的秒拍视频 ​ ​​​Elle 谢谢你们！[emoji]#王嘉尔##elle# ​​​因为周末去85℃买了很多面包，导致脸上长了几颗痘痘，我是第一次听说甜食吃多会长痘痘的，多亏小伙伴特地上网百度了，以后要小心了，得治嘴[思考][思考] ​​​这么小的差别我是看不出来的 ​​​[陈小春 不许Jasper混娱乐圈]陈小春这个语音采访笑死我了哈哈哈哈哈哈，把大家说组团去偷Jasper当真了！还说是要给大家欣赏Jasper有多丑（Jasper有多可爱山鸡哥您真的不知道吗）[允悲] 扒姐来了的微博视频 ​​​我可能是饿极了[笑cry][笑cry] ​​​
