孟津太阳神国灸养生,1,大众创业  万众创新最为有理的反思：先知先觉领导者，先知后觉跟随者，不知不觉消费者!物联网平台已经搭建成功进不进入决定几代人命运!帮你一年多赚10万、50万、100万，又不要你一分钱，你还等什么，如果你想马上改变你的生活，立即注册，成为自动化创富系统的一员--感恩于老师。你可以选择怀疑 ​​​ 全文
孟津太阳神国灸养生,9,直销只有坚持，才能尝到成功的甜蜜。就象翻动一副扑克牌，王牌总会出现的，只是迟和早。幸运的人，第一张牌就能翻到，可是只要你坚持翻下去，你的王牌，也一定会出现!只有付出了汗水、泪水和苦水，你才能获得高薪水。『我不会做也不会讲，能做直销吗？有可能成功吗？』http://t.cn/RO0frNZ ​​​【血管怎样一天天堵死的，太惊讶了！4件事做好，血管天天清！】http://t.cn/ROefon9(想看更多合你口味的内容，马上下载 头条日报)http://t.cn/RKP0gdr 洛阳·商业大厦(青岛路) ​​​【怕冷是你虚！阳虚、阴虚、血虚、气虚……你是哪一种？】http://t.cn/ROeVlgR(想看更多合你口味的内容，马上下载 头条日报)http://t.cn/RKP0gdr 洛阳·商业大厦(青岛路) ​​​#兰君随笔#   心在字里，沉醉不醒；情在行间，缱绻绵延。书一笔眷恋，挽一惜墨缘，静抒笔端，笔墨余香，情入诗行，是心灵的呼唤，于指尖缠绵地流淌。那墨迹上的香味正在袅袅的氤氲字里行间，也在洋溢着我的情深意长，温婉生命每个角落，点缀人生每次花开回望，感觉，是那么的温馨，纯澈而美好。那相伴 ​​​ 全文#看破世界#品悟人生# [心] 成长是一种经历，成熟是一种阅历。一个人，如果在生活中连自己对错都不能区分，责任都不敢担当，那还有什么理由去指责别人的不是。成熟的人，不为得而张狂，不为失而悲痛；竭尽全力之后，依然能够坦然地接受一切。@一路走来哈啰:认认真真做事/踏踏实实做人 #木事偷着乐#[耶] ​​​ 全文这是个令人尴尬的年龄，谈爱己老，谈死太早。和年轻人一起谈经历太幼稚，和老年人一起谈人情世故不好，出去疯狂又怕吵。任性说你扮成熟，沉默说你装清高，时尚说你有点妖，朴素说你有点老。觉得上气不接下气了，刚想消极下，回头一看，上面有老，下还有小！ ​​​尽赏大美金秋（二） ​​​我分享了 @新华视点 的头条文章 一文速览十九大报告 ​​​少年游：自叹云低推影，星高佈幕，寒月满明楼。柳探长丝，雁鳴天晚，坝上有人愁。西风叹，草枯霜漫，香断又临秋。岁月缺情，此生余恨，霜染已白头。 ​​​
张富勇F,6,"我们会遇到各种各样的事情，很多都是出乎意料的，开心、难过、成功、失败……总是在所难免，所以不要太纠结。如果你的一生还不错，你可以庆祝，如果你这一生很糟糕，也不要灰心，你总是幸运的拥有了这一辈子，不是吗？所以，从今天开始，让我们多点微笑！毕竟，人活一辈子，开心最重要不是吗？ ​​​人活一辈子  会跟很多人相识相遇，也会有分离。不过能像花一样留下余香，留下念想的人不算太多。花能在谢了之后  留下芬芬的香气，让人怀念。有内涵素养，心如花般美丽的人  也是会让人留恋万分，经常怀念。@北微风3779 延吉市 ​​​#历史上的今天# 歼灭敌军“西进兵团”。      1948年10月21日从沈阳出动一直迟疑逡巡的敌军“西进兵团”即廖耀湘兵团由彰武南下，从23日开始与东北野战军接触，无论哪个方向都遭到英勇顽强的阻击。我军攻锦主力当即迅猛回师，其他各路也作向心集中，约50万大军于26日将廖兵团合围在黑山、大虎山的约12 ​​​ 全文中国共产党第十九次全国代表大会在北京隆重举行！ 重庆·璧山县 ​​​成仁早禅:有些人绝对不能把他们当人看待。你越把他们当人看待，他们越把自己不当人看待了。对一个有了兽性的人固执地好下去，失望和伤害的一定是你自己。 阿拉善盟·额济纳旗 ​​​#情感空间#【感悟人生】 用一颗浏览的心看待人生。童年的天真、少年的痴狂、青春的浪漫，这些都是人生中的风情与风景。随着时光的流逝，这些人生的得与失，名与利都会逐渐逝去，唯有心中那些美好的回忆才是人生最美丽的风景。#杜鹃文学社##随手拍# ​​​“水利万物而不争”。最好的德行，就是泽被万物、服务万民而不争名利，以默默、不为人知的状态，涵养巨大的能量，产生深远的影响。“桃李不言下自成蹊”，不言不等于无言，不争不意味着不为。挣脱名利的束缚，追求大爱的人，才能最终成就大事业。 ​​​You’ll never find the right person, if you can’t let go of the wrong one. 紧抓着错误的人放不了手，又怎么可能找到对的那个人呢？ ​​​#青羊青年之声#【#十九大#，新时代！】中国特色社会主义进入了新时代。中华民族迎来了从站起来、富起来到强起来的伟大飞跃。中华民族伟大复兴的中国梦，终将在一代代青年的接力奋斗中变为现实。今天，#为新时代打call#；加油，中国！​ ​​​#警察小提示# 请大家告诉大家：【科目二倒车入库后视镜这样调，考试准过！】后视镜的调整，关系到考试能不能通过、驾照能不能拿到的问题！那么科二考试中，后视镜要怎么调整才更标准？调整后视镜的要领↓↓助你早日拿驾照！ 知车善用的秒拍视频 ​​​"
好好爱自己-016,10,"时间不早了，大家晚安！ 遵义·贵州航天职业技术学院 ​​​感谢@陳炫達叔叔  昨天给我转了3000元爱心善款，用于我购置电动轮椅，谢谢達叔多次大力帮助，我全家不忘達叔大恩，祝愿達叔您身体安康，好人一生平安，[心]  今天能给邮寄，大概四五天能到，期待[祈祷] ​​​今天下午到九华景翌环保公司送样品，一股刺鼻的香精味，闻久了很恶心，头晕。据周边人员说是和畅食品做槟榔的卤水味！臭和香过度了也是污染。请环保部门关注。@九华周报-九华网 @湘潭市环境保护局 @湖南省环境保护厅 @湘潭发布 @湘潭环保乞丐 @湘潭环保迪迪 @湘潭阿度 湘潭·社建村街区 ​​​伟大、正确、光荣的中国共产党万岁！……[心][拳头] ​​​【消防员大火烧身跳楼脱险[吃惊]】一小区发生火灾，因火势太大，一名消防员在扑火现场被大火围困，身上防火战斗服被烧燃。现场惊呼：“快下来！”情急之下，消防员利用落水管支撑跳楼逃生，除了手被烫伤，其他无大碍。致敬逆行英雄！ ​ ​​​我发表了头条文章:《雷锋车队郝师傅乐意助人帮助失忆老人寻找家人》 雷锋车队郝师傅乐意助人帮助失忆老人寻找家人 保定出租车雷锋车队的微博视频 ​​​#汕尾吃喝玩乐# 【汕尾美食】深夜里，美食来一波吧，这技术我觉得开餐馆卓卓有余。[挤眼] ​​​【多亏了中国人保护 大熊猫不再是濒危物种了[赞]】国际自然保护联盟日前宣布，得益于中国政府几十年不懈保护，大熊猫已不再属于濒危物种。按国际自然保护联盟划分，大熊猫从""濒危""转移到“易危”名单下。最新估测，成年大熊猫目前数量约1864头，加上幼崽，总数预计达2060。多亏了中国人的保护 大熊猫不再是濒危物种了界面 ​​​【暖心！学姐备战考研 学弟送早餐[心]】考研，我们来了！不要再为女生不适合理科正名了，因为距离2018年考研只剩两个多月，你准备得怎么样？如何合理分配上课、实习和考研复习的时间？不同阶段，怎样备考才能最高效？复习遇到瓶颈，坚持不下去了怎么办？过来人的7个考研建议，帮你少走些弯路，戳图学习 ​​​ 全文#中国人的故事#【@所有人，喊你谈谈感受和期待】十九大报告中，一组组数据、一件件实事，让老百姓感受到满满获得感。过去五年，你的生活发生了哪些变化？未来五年，你有哪些期待和憧憬？你想对祖国说什么？戳视频看看我们收到了哪些百姓心声！中国青年网的秒拍视频 ​​​"
xiaoxiao燕子A,4,"为女生不适合理科正名女生都是仙女天生就是撩汉的！ ​​​肥旺旺——主治:食少、瘦弱、僵猪、生长缓慢主要成分:枯草芽孢杆菌速肥制剂(PB6)、乳酸杆菌、复合多维、氨基酸、丁酸、包被盐酸半胱胺肽、二氧吡啶、酵母菌、促长催肥保健剂、氨基酸螯合铁、铜、锌、抗病因子、保健因子、溶菌酶等高档原料。低聚寡糖、赖氨酸铁、苏氨酸锌、甘氨酸铜、复合酶(肠蛋白 ​​​ 全文一哥们在追一个女朋友，女朋友给他下了最后通牒：“没有奥迪A6和两层的别墅，就别来烦我。”他苦笑。回家和爸妈征求意见。父亲抽了支烟，叹口气说到：“车好办，家里的劳斯莱斯卖掉买几十辆奥迪还没问题，只是这二层别墅，TMD咱总不能把这五层楼扒掉三层吧，太可惜了，你和她还是算了吧，天下姑娘多的 ​​​ 全文不论结局，我已经很感谢相遇。  Regardless of the outcome, I have been very grateful to meet. ​ ​​​海上月是天上月，眼前人是心上人。 向来心是看客心，奈何人是剧中人。 ——张爱玲 ​​​​背诵了它，你的完形填空就牛逼了。[酷] ​​​更多外语知识请关注我哦[抱抱] ​​​把喜欢的人放在心里，冬天就会暖和一点。[可爱] ​​​​分享图片 东营·仙河镇 ​​​『每日必练鬼步舞《seve》牛人舞蹈教学分解动作』每日必练鬼步舞《seve》牛人舞蹈教学分解动作 ​​​❀""一直忘了告诉你我有多幸运 遇见的是你""I always forget to tell you thathow lucky I am to encounter you ​​​"
丹江洗尘,2,"外表的衰枯孕育着一种轰轰烈烈的繁荣。 ​​​@商洛核桃袁芳齐 @新健康zhang @小微王果 @霹雳雷霆震震震震 @秦子风蜜 @小微王果 发布了头条文章：《你和我之间，就差这一碗面的距离》 你和我之间，就差这一碗面的距离 ​​​人生的0.01秒在aba赛场表现得淋漓尽致，在aba揭幕战勇士和火箭的比赛中直到0,01秒才知道结果。我们生活中有多少0.01秒可以重来。[NBA]常规赛10月18日：火箭VS勇士 全场集锦 ​​​关注十九大，不忘初心跟党走文/丹江洗尘十九大召开的前一天，商洛盛泽商贸公司和公司党支部就决定让所有员工和党员停止手上的一切工作，每个人不离开办公桌，在电脑上看十九大播出现场的实况新闻。具有历史意义的2017年10月18日一大早，公司员工和党员早早打开电脑，带着兴奋和期等待着这神圣的时刻 ​​​ 全文黄姜丰收了!扶贫到家了！生活有坎了！总裁有范了！圆圆羞涩了！羊也出头了！小狗家倒了！商洛有仙境了！老树核桃找到了！ ​​​天冷了，地冻了，贫困户的日子难过了，政府开始行动了，精准扶贫启动了！十九大明天召开了，新政新令出台了，老百姓有个盼头了，村干部不敢再贪了，好日子就要来到了。 ​​​偷菜文/贾军平三牛、二娃一伙邻居们是住在龙王庙半山腰的村民，以什么工程为由被搬进城里。每家出了不到十万元分得80平米的房子，分布在8楼，15楼，28楼不等的高楼里。开始想不通住在村子有吃有喝，空气新鲜，还清闲自在，几辈人都习惯了，不明白村镇干部为啥跑了那么多次，说了那么多话，填了那么 ​​​ 全文核桃不白，但生下就是这样子，没用漂白剂；个儿不大，绝对没有转基因，有亲生父母。外表是假象，脱光衣服让你一饱眼福，嗨！肌肉丰满，筋骨结实，你不用对这么好的肌肉想入非非，早豁出去，敢让你吃，敢让你爵，不反对你回味，不让你吃出来秦岭深处的老树核桃的味，绝对不是商洛蓝品牌的核桃。    为 ​​​ 全文"
顺然远程1983,10,人间最美是金秋走进金秋的十月，秋色宜人，秋有一种特有的美，极富诗意的季节。天高云淡，清风凉爽。它披着一身金黄，秋光绚丽，千姿百态，金秋的阳光温馨恬静，微风和煦轻柔，蓝天白云飘逸，秋天的美，美在清澈，美在明净，一派醉人的美丽秋色。行走在金秋画卷，秋意正浓。观看秋色，田野遍地金黄， ​​​ 全文【官方澄清竟然阻挡不了谣言扩散，阿里今日正式起诉多个自媒体账号】“马云十亿豪宅亮瞎眼”“马云四十亿豪宅奢华无比”、“马云五十亿豪宅再曝光”这些引力波一般的标题也许曾不止一次赚到你的眼球。阿里巴巴集团今日表示，虽多次辟谣，但类似谣言反愈演愈烈，决定正式起诉“智慧人生”、“老板思维模 ​​​ 全文有钱人送了吴昕一辈子用不完的mac；有钱人送了何穗可以换50个男朋友的tf；有钱人送了范冰冰一整棵树的Lv包包；贫穷不止限制了我的想象力，贫穷还让我嫉妒到七形[ok] ​​​杭州G20的警察，好帅噢！ ​ ​​​【香港今日发生恶性伤人事件  阿富汗男子无故将港铁女职员推下站台[怒]】一名港铁女职员今晨在轻铁元朗站执勤时，被一名来自阿富汗的56岁男子从背后猛推入轻铁轨道，所幸当时没有列车驶入，女职员逃过一劫。该男子犯案后头也不回，继续走向月台另一边。香港警方在接警后迅速赶来，在事发现场附近拘捕了 ​​​ 全文我刚刚开通了#粉丝服务平台#，马上关注我即可通过私信获取我的独家资讯和服务。已经关注我的粉丝，请发送私信“DY”给我，激活您的专属特权，一起感受一下吧... ​​​#直通十九大#【何立峰：预计全年6.5%左右的预期增长目标将顺利实现】国家发改委主任何立峰21日表示，今年以来，经济稳中有进、稳中向好的趋势继续巩固，预计全年6.5%左右的预期增长目标将顺利实现，并能够争取更好的效果，今年底经济总量将超过80万亿元。#国是论坛# ​​​何为人性化管理？有钱人开轿车横行天下；穷苦人开三轮接送学生就扣车罚款甚至被砸烂。这就是人性化管理？国家提倡减排节能，千家万户老百姓都普遍使用电瓶车电三轮非常方便。但政府一声令下电三轮禁止进城。这也叫人性化管理？所以说很多事情我们不能光听政客们的高调，要看他们究竟是怎么做的！ ​​​#十九大#【#给青年的一封信# | 欣赏你一往无前的奋斗姿态】仔细想来，我们青年人身上的“焦虑”与“丧气”，不也是一种水涨船高的期待吗？放在一代人的角度看，我们奋斗的使命，已不是在一穷二白之上平地起高楼，而是向着更高远的目标冲刺。用力活着，才有分量；向前奔跑，才能抵达。  ​​​ 全文别以为回忆渐行渐远，其实一直在努力向你靠近，则是有些亲切的话语，像是淹没在记忆的信纸上，那道深深的折痕里。 无锡 ​​​
用户3804931632,2,"分享有礼 http://t.cn/ROgoOxx ​​​这个很赞哦... http://t.cn/ROgoOxx ​​​这个很赞哦... 美式乡村麻绳吊灯loft复古工业风创意个性客厅餐厅网咖服装店灯具 ​​​工业风壁灯美式乡村实木复古loft创意个性咖啡厅酒吧餐厅过道船木 ​​​这个很赞哦... 工业风吊灯美式乡村复古怀旧创意个性餐厅酒吧咖啡厅车轮灯具灯饰 ​​​原来答案是酱紫啊[羞嗒嗒]我从#微博帮助#分享了""我的应用满足认证条件，为什么不能通过认证？"",微博帮助 - 问题分类 [转发]内容有帮助，点击有用给个好评呗[加油啊] ​​​原来答案是酱紫啊[羞嗒嗒]我从#微博帮助#分享了""认证申请被拒提示”由于您的帐号不属于微博应用分类，请选择正确的分类后重新申请”代表什么"",微博帮助 - 问题分类 [转发]内容有帮助，点击有用给个好评呗[加油啊] ​​​我分享了话题#微博微群# ​​​"
用户6378279068,3,周末最无聊了[泪] 重庆·江北区 用户6378279068的秒拍视频 ​​​今天我的「微博等级」又升一级，记录一下我在微博的成就微博等级，升等级享好礼 ​​​#破界／BAZAAR150周年时尚艺术大展#震撼来袭！9月25日-10月20日 走进北京今日美术馆，感受破界、拥抱新生力，与众多明星一起分享时尚的力量！购票请点击http://t.cn/Rpklb28更有线上美术馆http://t.cn/R0PPuu1带你抢先探寻150年时尚发展历程，回顾美与艺术的历史。 ​​​[太阳]阿昌[太阳]纨绔团队 [爱心]看到这些视频突然心很无奈孩子们都这样长期低头爬着写字✍️，不是近视就是高度近视，还有更严重的，请父母们真的要重视了…… 重庆·木耳镇 纨绔人77996的秒拍视频 ​​​1岁阿拉斯加妹妹，名叫土豆。于10月13日下午6点半左右，在重庆市南岸区弹子石新四村弹子石老街附近丢失。狗狗是十字架，但是黑色不太明显，毛刚剪，毛不是特别长，身高64厘米，体重70斤。主人现在很着急，希望好心人看到能尽快联系15123256849，找回必有重谢！ 重庆·涂山镇 ​​​
各号注意我是北京,6,#搞笑##日本 #笑疯！大肚腩撞出激情声效，怕是对才艺有什么误解！微丢的秒拍视频（上#秒拍#看我的最新短视频，下载秒拍->http://t.cn/R09bnBc） ​​​抱歉，此微博已被作者删除。查看帮助：http://t.cn/Rfd3rQV【二手房旧床拆出金银珠宝和4万存单，新房主报警找到物主家人】10月11日，市民毕先生在装修自己新买的二手房时，在拆除一张旧床时拆出了一个包，里面装有金银珠宝还有一张4万元的存单，前房主明确表示并非自己的东西。为了明确这包金银珠宝的主人并尽快归还，11日晚22时毕先生来到中华路派出所。警方了 ​​​ 全文我免费围观了 @孔庆东 的回答，问题价值 433.00 元，快来一起免费围观~ 微博问答:孔老师，上回关于白鹿原的提问我已反思，感谢您的教诲，但觉意犹未尽。这回想请您具体谈谈白鹿原中的几个人物：白嘉轩，鹿子霖，白嘉轩之子白孝文还有傻子二豆。我还没有读 ​​​我免费围观了 @孔庆东 的回答，问题价值 433.00 元，快来一起免费围观~ 微博问答:孔老师，您怎么看这次人大师生对司马南的强烈抗议？难道司马南真的如网友所言引发群愤？  司马南成最短命教授 人大聘任3天闪电解聘 闭上双眼陶醉 2017.06.25 6月23日晚，中 ​​​我免费围观了 @孔庆东 的回答，问题价值 433.00 元，快来一起免费围观~ 微博问答:老師好！麻煩您看看我的命理吧。這一生應注意什麼？周鑫： 陰曆：一九七八年 二月十五日 夜裏十一點多，出生於內蒙古 呼和浩特 和林格爾縣 大梁村。現在河南鄭州開辦學堂。 ​​​#follow-me# 主观题背诵首播&今日时政解读（来自一直播:考研政治任燕翔正在直播）APP下载地址：http://t.cn/RMTjWBI ​​​#follow-me# 《主观题应试宝典》的配套课程由两个部分组成：一个是线下的半天完整课程，包括视频和面授，10月14日已经录制完毕，各地文都会陆续组织上课。这个课程上的时间稍晚些没关系，但一定要上。这个课程是将所有科目的主观题固定考查套路、背诵范围和内容、背诵精度要求和答题套路的。另一个是一 ​​​ 全文【收好这张思维导图，一起学习#十九大#报告！】一张思维导图，涵盖关键知识点↓↓工作学习必备，转发收藏！ 收好这张思维导图，一起学习十九大报告！ ​​​我免费围观了 @鲍迪克 的回答，问题价值 72.00 元，快来一起免费围观~ 微博问答:最近在看大秦帝国，请教鲍老师如何看上山下乡？现在学校条件太优渥，部分优质中小学配备空调洗衣机等等，大学配备各种高档运动场所，甚至是娱乐场所，您认为对青少年将来是 ​​​
淘宝内部券白菜,4,#为福利打call#庆祝抽奖君粉丝突破400万@微博抽奖平台 怎么能少了克洛伊送福利[兔子]关注@克洛伊全球旅拍厦门站 +转发送：iPhoneX → 1台10月25号晚上开奖 ​​​​10月20日0点至11月11日0点2017天猫双11红包，电脑党 http://t.cn/ROkHk9u 手机党淘口令：￥NwAw05iUV37￥直接扫码面额0.5、0.8、1、2、1111仅限双11当日使用，全网通用 ​​​​保存好图片 ​​​冬季珊瑚绒睡衣女法兰绒睡衣长袖甜美可爱加绒加厚保暖家居服套装【包邮】【在售价】98.80元【券后价】58.80元【下单链接】http://t.cn/RWL0U3N-----------------复制这条信息，￥ut8Y05uIqlH￥ ，打开【手机淘宝】即可查看 广州·黄石街区 ​​​宝宝薄棉衣套装纯棉新生儿夹棉加厚保暖内衣男女童棉服冬婴儿衣服【包邮】【在售价】39.90元【券后价】19.90元【下单链接】http://t.cn/RWLp3eb-----------------复制这条信息，￥gMG705uqDKU￥ ，打开【手机淘宝】即可查看 广州·黄石街区 ​​​#最全红包口令分享的红包#红包不停，好运连连！d(≧▽≦*d)我刚刚抢到了最全红包口令分享 和@白菜挖 联手发出的现金红包！小心脏激动得扑通扑通哒~新的一年跟我一起抢红包吧！最全红包口令分享 的红包 ​​​#寻找校园故事#随手一抽，红包到手！我刚刚抽到了@微博校园 的现金红包！这只是个开始，据说还有高达200元的大红包呢！ 不说了，我继续抽红包去了！微博校园 的红包 ​​​鹿皮绒毛呢外套女中长款2017冬季新款韩版加厚保暖羊羔毛呢子大衣【包邮】【在售价】268.00元【券后价】188.00元【下单链接】http://t.cn/RW7U9hd-----------------复制这条信息，￥p4OA05nb9aG￥ ，打开【手机淘宝】即可查看 广州·黄石街区 ​​​洗澡篮洗浴篮洗澡篮浴筐 洗澡篮子手提浴室 沐浴篮篮子塑料收纳筐【包邮】【在售价】14.90元【券后价】9.90元【下单链接】http://t.cn/RW7L5L9-----------------复制这条信息，￥lKVl05n2Ai0￥ ，打开【手机淘宝】即可查看 广州·黄石街区 ​​​#旅行双11#来了！@新浪旅游 联合@飞猪 #飞猪全球游#带来一大波机票、酒店、旅游产品信息！要出去玩的千万别错过，省出一个iPhone X不是梦！转评赞活动页内带红包标志的微博，即可抽取现金红包大奖！活动详情见↓↓图，猛戳→#旅行双11#立刻参加活动！ ​​​#旅行双11#中了中了，我抽中了@新浪旅游 的现金红包，相信我还可以抽中更多！新浪旅游 的红包 ​​​
王者荣耀爬坑宝典,2,#王者荣耀#版本强势英雄哪吒果然很强，难怪长期占据胜率榜第一，大招飞的后排生活不能自理，用他直接上王者了，强烈推荐[憧憬] ​​​王者荣耀S9赛季前的一波英雄调整，张飞、百里守约、花木兰、狄仁杰被削弱[并不简单] ​​​#王者荣耀#这三角恋搞的，到底谁和花花是官配的CP，求解答[吃瓜] ​​​这就是#王者荣耀#敌我英雄之间的差距，我已经受到一万点暴击伤害[允悲][允悲][允悲] ​​​传说这个是欧美的农药，不知道好不好喝[笑而不语] 王者荣耀爬坑宝典的秒拍视频 ​​​这是一个励志的故事[doge] ​​​#王者荣耀#新版的登陆界面好Q，少女心爆棚 王者荣耀爬坑宝典的秒拍视频 ​​​打王者的时候怎么知道队友是妹纸？撩妹套路教给你啦~能不能有对象就看你自己造化了哟~[笑而不语]#王者荣耀# ​​​#王者荣耀#王者知道最全答案，拿走不谢，点赞攒人品抽皮肤[笑而不语] ​​​#王者荣耀#这个厉害了，简直是手绘打印机 王者荣耀爬坑宝典的秒拍视频 ​​​
用户6382535998,1,瑛兰傲雪:是F-4EJ改战斗机，F-4EJ曾经一度是日本航空自卫队的主力制空战斗机，后来在大量装备F-15J/DJ后，F-4EJ被作为攻击机使用。1981年起进行现代化改进，计划改进 100 架。改进项目包括换装AN/APG-66J火控雷达、J/AYK-1中央计算 ​​​
qzuser711992017,1,"物流1702班""班级格言大比拼""——“年轻没有失败 青春炫出色彩”@内蒙古交通职业技术学院团委 赤峰·海贝尔游乐城（商圈） 周周小怪兽_09的秒拍视频 ​​​"
