O三羊开泰O,4,【科目三怎样一次性通过？只要做到这些，稳过！】一踩离合二挂挡，三转灯四看镜，五放手刹六抬脚。科目三考试是路考的最后一关，怎样一次性拿下？技巧都在这里了↓↓知车善用的秒拍视频 ​via人民日报 ​​​【驾考新规开考首日，某考场全军覆没？！[允悲]】10月1日起，驾考新规正式实施。网传南宁某考场科目二考试全军覆没…还有教练反映，在使用新规考试的第一天，科目三150人参考，仅1人通过[伤心]原因是：新旧规则交替期间，培训时仍然按旧规定训练...[话筒]划个重点，看下新规有哪些变化！（后厂村之花） ​​​【速转这份新驾考“通关秘籍”，助你驾考一次过！】10月10日，“史上最严驾考新规”开考，全国多地合格率明显下降。新旧规则交替期间，新版评判标准一定要记牢：210秒内未完成倒车入库不合格、90秒内未完成侧方停车不合格、下车开车门前不回头看不合格…驾考新规评判标准+驾驶技巧↓转给正在学车的TA！ ​​​ 全文#就业有位来#【[推荐]9张图，让你瞬间变PS高手、职场达人，转起学习！】 ​​​【惊！诺贝尔医学奖发现“熬夜令人变丑变笨” 你还敢晚睡吗？】今年诺贝尔生理学和医学奖获得者研究发现，熬夜会令人变丑变胖变笨。现在越来越多人熬夜，且多与手机有关。医生：长期熬夜易导致高血压、内分泌异常，代谢紊乱引起糖尿病，甚至肿瘤。看看新闻Knews的秒拍视频昨晚你几点睡的？ ​​​【惊！诺贝尔医学奖发现“熬夜令人变丑变笨” 你还敢晚睡吗？】今年诺贝尔生理学和医学奖获得者研究发现，熬夜会令人变丑变胖变笨。现在越来越多人熬夜，且多与手机有关。医生：长期熬夜易导致高血压、内分泌异常，代谢紊乱引起糖尿病，甚至肿瘤。看看新闻Knews的秒拍视频昨晚你几点睡的？ ​​​#环球微评#【中印边界“示好”比“怒怼”强】有印度媒体报道说“中国在边境地区增兵”，据说为此印度国防部长急匆匆地赶到中印边境地带。而在与中国解放军边防官兵隔着边界面对面交流时，这位女防长向中方军官双手合十致意，表示“你好”。中国军官也以“你好”回应。撇开女防长此行的实际目的，单就“ ​​​ 全文【高一到高三所有的数学公式，接稳喽～[赞] ​​​】因为 关晓彤会解二元一次方程，所以得到了爱情。所以你的数学成绩还好吗？[嘻嘻] ​​​【拉斯维加斯警方公布枪手身份 并已锁定与枪手有关的女性】拉斯维加斯警方公布，枪手名为史蒂文·帕多克（Stephen Paddock），64岁的当地居民。警方还称，基本确定锁定了与枪手同行的那名女性的藏身地点。此前警方称，在枪手射击的房间内警方发现了大量武器，目前已经对枪手的住所下达了搜查令。美国总 ​​​ 全文#拉斯维加斯枪击# 【旧金山总领事馆成立赌城枪击案应急工作组】旧金山时间10月1日晚，拉斯维加斯发生枪击案，中国驻旧金山总领馆正密切跟踪事件进展，迄未尚未收到中国公民伤亡情况报告。事件发生后，我馆在第一时间成立了以罗林泉总领事为组长的应急工作组，我们将继续与美方保持密切联系，了解中国公 ​​​ 全文
暧昧的稳,4,苦难不是生命的全部却摧毁了一半的幸福，在无法预知的流年中美与丑、真与假似乎都是难以形容的事物，一切的不安也许已经为竞争的过程打开了冲刺的阀门，终点是句号还是逗号亦或是省略号依然要从开头那个结尾说起。     ————勤静忍《水晶球的秘密2:黎明的黄昏》 西安·韦曲 ​​​迷雾的斑驳遮掩了真相的残忍，在理性和意见的智慧锦囊中夹杂着理智的认识，残缺的记忆抹杀了往昔的完满，在激情和堕落的情感交换中裹挟着幸福的光影，生命的轮转似乎依然是原来的样子，没有加快的速度也没有减缓的频率。     ————勤静忍《水晶球的秘密2:黎明的黄昏》 西安·韦曲 ​​​简单的复杂的好像来自于外部其实来自于内心，沉重的轻松的好像主宰着别人其实只是束缚了自己，浩瀚的渺小的好像自然的全部但却是意志的缩影，一切的平衡都在恒定中发生着变化，无论是幸福的光临还是痛苦的侵扰。    ————勤静忍《水晶球的秘密2:黎明的黄昏》 西安·韦曲 ​​​忧伤总是没完没了地影响着欢乐的频率，在和谐快要到达光辉的顶点时动荡又纷至沓来，孤独总是没完没了地打断着温馨的画面，在勤奋将要赢得成功的奖赏时倦怠又鲸吞一切，陌生总是没完没了地模糊着熟悉的面孔，在非凡即将摘取华美的王冠时平庸又卷土重来，所有的安宁总是那样短暂，就像流星美得璀璨却只有 ​​​ 全文光明总是来得很晚但它终究会降临，当血红的烈焰驱逐了残留在眼眸里的忧伤时，温馨的色调从来都不是一种简单的寄托，救赎总是陷入被动但它终究会觉醒，当宽恕的力量扑灭罪恶的欲念获得博爱的褒奖时，谦卑的认错从来都不是一种仓促的敷衍，信任总是沾满谎言但它终究会逃离，当深厚的情谊划破虚伪的面具照 ​​​ 全文法籍华裔作家高行健的长篇小说《灵山》。。。[心][心][心] 西安·韦曲街区 ​​​理性与感性只差冲动的距离，却让两张熟悉的面孔从此变得陌生，幸福与痛苦只差感悟的距离，却让迷惘的心灵找不到归宿，战争与和平只差杀戮的距离，却让权力的王座充满了纷争，一切的孤独并不是别人创造的而是自己封闭了自己，那些打开心结拥抱天窗的生命终究会得到梦想的眷顾。    ————勤静忍《水晶 ​​​ 全文忧伤有时候并不是来自外部而是来自内心，所有的苦闷也许只是失去了控制的平衡，当心态完全达到真正的平和时快乐就会在不知不觉的蹉跎中悄然而至。    ————勤静忍《水晶球的秘密2:黎明的黄昏》 ​​​一切的苦痛似乎都在为下一次的幸福积蓄着能量，而下一次的幸福似乎又在绝望的尽头孕育着苦痛，所有的情感似乎都在轮回的轨道里周而复始地变化着、循环着，好像昨天和明天的距离那么远又那么近。    ————勤静忍《水晶球的秘密2:黎明的黄昏》 西安·韦曲 ​​​阴暗的气息远离了黑夜的源头是否就可以感受到微弱的光明，光明的足迹踏遍了白昼的内外是否就可以感受到阴暗的存在，虚幻的梦魇阻隔了现实的无情是否就可以感受到星月的拥簇，星月的温暖点燃了火热的激情是否就可以感受到梦魇的侵袭，权力的纷争扼杀了自由的翅膀是否就可以感受到至上的荣耀，荣耀的花火 ​​​ 全文
那年认真的雪,1,不要总为一件不开心的事情耿耿于怀。 ​​​
爱谦1亿年,1,怎么说也快千万粉了，这次就在这条微博的转发里抽6个粉丝送你们一人666大洋庆祝一下吧。国庆过完开，么么哒[羞嗒嗒] ​​​
贾舒涵kita,6,"“如果有一天，我们结婚了，我只希望，那是因为爱情。我想和你走到最后，相濡以沫，携手终身。我怀着这样的想法和你在一起，为了到花甲之年依然有句我爱你。” ​​​​“一直都想告诉你     其实我过得没那么好     还是常想你  经常梦见你      只是时间让我学会了闭嘴     因为 孤独是常态     很多路都要一个人走    熬过去就好了” ​ ​​​♡         变心是本能 忠诚是选择        很开心你能来 不遗憾你离开        不能相濡以沫 那就相忘于江湖        从此 一别两宽 各生欢喜 ​ ​​​​人生本来就没有相欠别人对你付出，是因为别人喜欢你对别人付出，是因为自己甘愿情出自愿，事过无悔 ​​​​如果你是微胖或想快速瘦全身，可以试试这套10天快速减脂教程，无论你是想瘦腿、瘦腰、美臀还是练马甲线，都可以用这套动作，快速减肉的朋友一定要马！ S小姐的完美身材的秒拍视频 ​​​当你觉得她不再如初见时那般“乖巧懂事”，当你觉得她变得越来越“无理取闹”，这说明她已对你的爱越来越深，也说明了你对她的爱越来越少。 ​​​​路，在不通时，选择拐弯，心，在不快时，选择看淡；情，在渐远时，就选择随意。 ​​​​张爱玲曾经说过：""忘记一个人只需要两个东西，时间和新欢。你选择了新欢，而我选了时间。 ​"" ​ ​​​​有钱才敢做最真实的自己，没钱只能做别人喜欢的自己。 ​​​​人生本来就没有相欠别人对你付出，是因为别人喜欢你对别人付出，是因为自己甘愿情出自愿，事过无悔 ​​​​"
宇稳灵儿,3,谁说走路就是拼步数，走过1000就算赢！我已经在微博运动完成了首个千步行走，赢得蜗牛侠勋章一枚！等你来走！ ​​​我在这里 泰兴·张桥镇 ​​​今天我的「微博等级」又升一级，记录一下我在微博的成就微博等级，升等级享好礼 ​​​今天我的「微博等级」又升一级，记录一下我在微博的成就微博等级，升等级享好礼 ​​​分享一个不错的MV：Heize-《和你在一起的时间里》（来自 @酷狗音乐 海量曲库，极致音质）http://t.cn/R0dsGEC ​​​【一起转发这条微博！和爱豆唱出#我爱你中国#】快来和@TFBOYS组合 一起唱《我爱你中国》！除了在微博上传自己的演唱视频，你还可以在秒拍#我爱你中国#活动专区上传视频！参与活动不仅有机会获得定制奖品，你的精彩视频还可能和偶像一起，亮相公交、地铁和城市大屏！ 人民日报的秒拍视频 ​​​#王俊凯金九18成人礼# [美国]#王俊凯芭莎金九连创三纪录# 下一站，USA [飞机]️[飞机]️[飞机]️@TFBOYS-王俊凯 上海·上海浦东国际机场 ​​​分享图片 泰兴·张桥镇 ​​​#微博卡片背景#  青春正当时，我有我的Young！我正在使用90后的回忆“致青春”会员专属卡片背景，一起换上卡片，秀出独特的你！ 卡片背景：致青春 ​​​
f美x丽y坊,4,[红灯][红灯]最近你的皮肤痒吗❓好多人最近脸上为什么总是不时地发痒 脱皮💥甚至有刺痛感？这是过敏了吗？[向右] [向右] 想告诉大家 是换季❗ 不要再错误的把这种皮肤症状理解确认成过敏啦，这是缺水的信号！！[眨眼][眨眼] f美x丽y坊的秒拍视频 ​​​⚜小白瓶[5]️大功效 : 祛痘、祛痘印、收缩毛孔、粉刺、嫩肤、美白。[5]️大亮点: 排毒、纯草本、无激素、不依赖、不复发无副作用。   五个功效一个对策、那就是使用中药小白瓶‼️ ​​​【小黑瓶】🌿纯中药祛斑霜：熊果素，天然维生素E，维生素C，，上等珍珠粉，茯苓，等40多种纯中药研制而成❗️淡斑，去黄美白，细致毛孔，修复红血丝，完美的肌肤是养出来的❗️纯中药美白祛斑霜可以做到‼️ ​​​领取方式： 18块运费＋转发朋友圈，包包免费送。亏钱送福利只为充实朋友圈[玫瑰] ​​​明星同款时尚热销双肩小包，超大容量，出街必备，稳赚回头率）[爱心]️[爱心]️[爱心]️ ​​​[4]，本宝宝送福利啦[气球]时尚卷发梳，简单大方！主要实用[机智]有人想要吗？想要的私信我：我想要卷发梳[勾引]喜欢的点赞告诉我…… ​​​3，本宝宝送福利啦[气球]火烈鸟，简单大方！主要实用[机智]有人想要吗？想要的私信我：我想要保温杯[勾引]点赞告诉我多少人想要[鼓掌][鼓掌][鼓掌] ​​​2️⃣，本宝宝送福利啦[气球]时尚包包，简单大方！主要实用[机智]有人想要吗？想要的私信我：我想要包包[勾引] 3 ​​​[1]，好久没给大家送福利啦，所有小主们，关注朋友圈，加宝宝微信  给大家送礼啦[礼物] ​​​
纯水年华,5,#世界晚安#【一段视频，感受秋意浓[好喜欢]】山西运城中条山的树叶开始变红了，从空中俯瞰，山岭五彩斑斓。你那里的秋色如何[月亮]（央视）央视新闻的秒拍视频 ​​​【别人家的学校！山东一小学高尔夫成必修课】山东济南，经五路小学将高尔夫球运动引入校园，建起了600平方米的练球场。高尔夫不但作为社团选修课，还成为三年级的必修内容[并不简单]#小未看教育#你怎么看？[思考]一手video的秒拍视频 （梨视频） ​​​【小伙单膝跪地求婚 女友反手就砸来一个苹果[费解]】小伙和交往7年的女友一起摘苹果时，突然单膝跪地，掏出戒指向女友求婚，谁知女友反手就往他头上甩了一个烂苹果...原来，由于小伙以前拿假求婚恶搞了太多次，让女友以为这回又是“狼来了”的故事。不过，求婚过程虽稍显曲折，结局还是一口狗粮[doge]  ​​​ 全文#老外看中国#【中国共产党领导的改革为什么成功？法国前政要如是说——】法国前总理“让-皮埃尔·拉法兰”对很多中国人而言并不陌生。中国的改革与发展，始终是他密切关注的话题。拉法兰认为，中国共产党的高效领导力是中国快速发展的关键... ↓↓ 参考消息的秒拍视频 ​​​【党代会在身边：小哥地铁手机收听 雄安新区人民撑伞观看】#十九大召开#之际，全国各族人民满怀期待。不少网友在网上发布信息，表达喜迎十九大的欢快心情。 党代会在身边：小哥地铁手机收听 雄安新区人民撑伞观看 ​​​【习近平：青年兴则国家兴，青年强则国家强】青年一代有理想、有本领、有担当，国家就有前途，民族就有希望。中国梦是历史的、现实的，也是未来的；是我们这一代的，更是青年一代的。中华民族伟大复兴的中国梦终将在一代代青年的接力奋斗中变为现实。#十九大召开##青春中国梦·圆梦中国人# ​​​#十九大召开#【习近平：坚持房子是用来住的、不是用来炒的定位】习近平：坚持房子是用来住的、不是用来炒的定位，加快建立多主体供给、多渠道保障、租购并举的住房制度，让全体人民住有所居。 ​​​#领航中国#【十九大开幕前一天，震撼大片《领航》上线！】2012年，新一届中央领导集体登上历史舞台时，中华民族正站在一个前所未有的关键节点上。回首5年，时代的天空风起云涌。面对世情国情党情深刻变化，以习近平同志为核心的党中央如何引领中国号巨轮破浪前行？#十九大召开# 新华视点的秒拍视频 （ ​​​ 全文#微观十九大#【中国共产党第十九次全国代表大会今天上午9时在北京人民大会堂开幕，央视新闻新媒体现场直播】 央视新闻的微博直播 . ​​​【这个活动凭什么7个月吸引了上千万孩子参与？原来是“向习爷爷说句心里话”】“习爷爷，您好！我是一名少先队员，我们都觉得您很伟大，把党和国家管理得井井有条。我一定好好学习全面发展，长大后报效祖国。”今年，全国少先队组织普遍开展“喜迎十九大—我向习爷爷说句心里话”主题活动，究竟是什么 ​​​ 全文
寒山月5366,3,分享图片 咸阳·土桥镇 ​​​3\苹果可帮助护理秀发:用苹果制成的苹果醋可帮助肌肤去除头屑，护理秀发效果非常好，可在清洗干净头发之后直接倒适量苹果醋在头发上，并进行轻柔地按摩直至苹果醋中的营养被头发所圾収后再清洗干泽即可，头屑比较严重的美眉可以尝试哦! 咸阳·土桥镇 ​​​我发表了头条文章:《苹果可帮助肌肤平衡油脂分泌》 苹果可帮助肌肤平衡油脂分泌 咸阳·土桥镇 ​​​我发表了头条文章:《怎样用苹果来美容？》 怎样用苹果来美容？ 咸阳·土桥镇 ​​​分享图片 咸阳·土桥镇 ​​​分享图片 咸阳·土桥镇 ​​​#今日贴纸打卡# 想要好苹果找我[握手] 咸阳·土桥镇 ​​​
AA奢侈品复刻批发,4,一直在供最好的货给亲们，买的实惠，去专柜无压力。微信号:KT8862 ​​​一直在供最好的货给亲们，买的实惠，去专柜无压力。微信号:KT8862 ​​​一直在供最好的货给亲们，买的实惠，去专柜无压力。微信号:KT8862 ​​​一直在供最好的货给亲们，买的实惠，去专柜无压力。微信号:KT8862 ​​​一直在供最好的货给亲们，买的实惠，去专柜无压力。微信号:KT8862 ​​​一直在供最好的货给亲们，买的实惠，去专柜无压力。微信号:KT8862 ​​​一直在供最好的货给亲们，买的实惠，去专柜无压力。微信号:KT8862 ​​​一直在供最好的货给亲们，买的实惠，去专柜无压力。微信号:KT8862 ​​​一直在供最好的货给亲们，买的实惠，去专柜无压力。微信号:KT8862 ​​​一直在供最好的货给亲们，买的实惠，去专柜无压力。微信号:KT8862 ​​​
东北电商,10,庄淑秋新款兔毛绒挂脖圆领毛衣女套头宽松韩版袖子开口针织衫上衣庄淑秋新款兔毛绒挂脖圆领毛衣女套头宽松韩版袖子开口针织衫上衣 ​​​分享图片 ​​​分享图片2017年秋装新款妖都韩版大码女装宽松长袖外套圆领卫衣 ​​​朋友们，多多支持，本店销售要的人气，不要货，保证质量。2017年新款秋冬女装短款显瘦呢子大衣毛领都市韩版毛呢外套 ​​​连帽卫衣2017新款女秋韩版潮学生宽松bf 加绒加厚中长款宽松外套 ​​​2017新款秋装长袖T恤女纯棉韩版宽松学生秋季百搭外穿秋冬打底衫 ​​​连帽卫衣2017新款女秋韩版潮学生宽松bf 加绒加厚中长款宽松外套 ​​​2017秋冬新品韩版百搭纯色圆领喇叭袖貂绒毛衣女套头兔毛打底衫潮2017秋冬新品韩版百搭纯色圆领喇叭袖貂绒毛衣女套头兔毛打底衫潮 ​​​庄淑秋新款兔毛绒挂脖圆领毛衣女套头宽松韩版袖子开口针织衫上衣庄淑秋新款兔毛绒挂脖圆领毛衣女套头宽松韩版袖子开口针织衫上衣 ​​​半高领貂绒毛衣女套头秋冬高腰短款貂毛韩版宽松保暖兔毛针织衫厚半高领貂绒毛衣女套头秋冬高腰短款貂毛韩版宽松保暖兔毛针织衫厚 ​​​
花花世界中的女人,5,"【奥巴马将重返政治舞台 为州长选举站台】据美媒报道，美国前总统奥巴马卸任将近十个月，19日将首度重返政治舞台。他将参加新泽西州和弗吉尼亚州的州长选举造势活动，为民主党候选人拉票。报道称，11月7日举行的这两场州长选举被视为2018年期中选举的前哨战，也是对特朗普和共和党的一次重要测试。 ​​​【朴槿惠狱中读《德川家康》 韩媒：该书反映其内心抱负】“希望政治报复在我这里画上句号。”韩国前总统朴槿惠16日庭审的一句话引发余震不断。《东亚日报》18日报道，朴槿惠正在读日本小说《德川家康》（韩文版书名《大望》）。韩政界分析，朴槿惠或许想效仿德川家康，以忍耐之心迎来无罪释放，并重返 ​​​ 全文来了，来了。 俄国民主制度一个新星，克谢尼娅·索布恰克。其实，星， 她早就是了，莫斯科名媛，电视主持人，演员。白富美不说，还是官二代。她老爹是前彼得堡市长，普京的人生导师。 索布恰克今天宣布参加总统大选， 跟普京叫板。不过，普京还没正式宣布是否要竞选连任。很多反对派人士认为，她是在帮 ​​​ 全文【欧盟峰会上各国对加泰独立保持缄默：属西班牙内政】在西班牙政府19日宣布取消加泰自治后不久，欧盟召开例行峰会，却丝毫未提加泰问题。欧盟理事会主席称，“不认为欧盟应插手”。当日，法国、德国及荷兰领导人都表示，相信西班牙政府能妥善处理此事。据《路透社》援引在场欧盟官员，因为”惹恼马德里 ​​​ 全文#Ask Professor Michael about America# 您想更加了解美国吗？您对我们的习俗和传统有过好奇吗？您想知道在美国生活是什么样的？在美国工作是什么样的？在美国学习是什么样的？我将回答我的中国朋友们对我美丽国家的任何问题。请尽管问我！ ​​​【马云“忽悠”莫斯科大学生：我们有点钱，来一起做大事】18日晚，马云在莫斯科大学演讲，在分享成功经验后，马云向在场大学生宣布，阿里巴巴将在莫斯科建一所科学实验室，“我们有技术、数据和用户，当然还有一点钱”，希望有志青年与阿里巴巴一同努力，干件大事！ @时间视频 大佬时间的秒拍视频 ​​​祝贺！ ​​​#直播十九大#习近平说，坚持房子是用来住的、不是用来炒的定位，加快建立多主体供给、多渠道保障、租购并举的住房制度，让全体人民住有所居。#十九大全民观察团# ​​​刚来美国不知道这十条规矩被坑的很惨……Jeremy_杨家成的秒拍视频 ​​​An #American# named Tyson Walters is the proud owner of a huge Saint Bernard named Harley. He became frustrated when taking Harley for car rides because of all the hair Harley would shed. It went everywhere! So, he invented these hilarious, but practical dog leotards. #dogs# ​​​"
焕我生活abcd,2,"我在#微博会员福利#中领取了【汉堡王套餐抵用券】。微博会员送福利，权益多多，你也来看看吧！>> ​福利权益免费领！ ​​​[鱼]在这个移动互联网时代，资源整合是非常重要的！如果你也有实体店，欢迎你加入我们一起最好卖的发财面膜！要知道线上线下相结合一起赚钱两不误，一份房租两份收入！她可以——你也一定行‼️ 遵义·鸭溪镇 焕我生活abcd的秒拍视频 ​​​我参加了#微博会员福利#【会员特卖专场】，会员专享特价买买买！微博会员送福利，权益多多，你也来看看吧！>> ​福利权益免费领！ ​​​我卖的是顾客脸上的灿烂笑容我卖的是顾客由内而外的自信我卖的是顾客成就自我的魅力没错，我就是卖焕面膜的[捂脸] ​​​赶货赶货 焕我生活abcd的秒拍视频 ​​​,加油，让每一位患者都得到圆满的康复 焕我生活abcd的秒拍视频 ​​​[鱼]焕面膜最服帖，最薄[爱心]30ml精华天丝材质 最利于皮肤快速吸收到达真皮层让你皮肤由内而外喝饱水[水滴] ​​​快递哥哥也真够你忙的，又发货了[憨笑][憨笑] 焕我生活abcd的秒拍视频 ​​​[鱼]面膜这么多，为什么还要选择焕面膜❓给你三大理由够不够❓❗️焕我生活焕面膜[vs]其他面膜的区别❶普通面膜：大分子补水    焕面膜： 小分子精华！这样才能够真正深层补水❷普通面膜：一般服贴度    焕面膜：连同颈部360度包裹❸普通面膜：精华一般在20ml     焕面膜：精华含量为30ML💧 ​​​[鱼]焕面膜是我卖货最有底气的产品，也是我这辈子用过最多的面膜‼️正因一个好的产品，觉得物超所值，才会发自内心地推荐。到现在总有我不认识的人加到我，我问是谁推荐的，说出的名字总让我惊讶。因为更多是平常没说过话的朋友微友，默默关注你身边有人想做微商第一个就想推荐你。这是深入人心的东西 ​​​ 全文"
荷cYe不颜,1,"小时候总想长大，长高到能够到脚蹬子。我正在使用""胡同里的自行车""封面图，好漂亮，你们都快来试试！http://t.cn/RU1uJVF ​​​"
周红艳66,3,坐姿不良、低头玩手机、长时间吹空调…这些都是颈椎病的诱因。严重的颈椎病甚至影响走路，导致瘫痪！颈椎病该怎样自测？如何正确保养颈椎？…实用颈椎保养手册↓↓转给低头族！ [来] ​​​【颈椎放松操】今天教大家一套缓解治疗颈椎病的操，一共5个动作，每个动作一分钟，非常实用，分享给电脑、办公族们！ ​ ​ ​​​​加我微信有红包 十堰·红卫路街区 ​​​加我微信有红包 随州·环潭镇 ​​​加我微信有红包 武汉·金色港湾 ​​​今天我的「微博等级」又升一级，记录一下我在微博的成就微博等级，升等级享好礼 ​​​加我微信有红包 武汉·金色港湾 ​​​加我微信有红包 武汉·金色港湾 ​​​
