马小宪20k,3,我用@悦动圈 走了4393步。已运动32天，共13.87万步。赞不赞？ http://t.cn/ROe1FGG ​​​我的微博等级达到Lv9喽！想想就有点小激动呢[太开心]小伙伴儿们快来看看你的等级好礼微博等级，升等级享好礼 ​​​我在通过微博支付积分商城做任务赚积分，积分轻松赚，礼品天天换，快来一起做任务赚积分吧！链接：做任务赚积分，豪礼送不停 ​​​@微博会员 这波操作，我给满分！我已通过会员校园活动领取麦颂50元代金券，嗨翻课余生活全靠它了！现在参与还有现金红包抽，人人有礼，就等你来！速来！寻找校园福利领取人 ​​​来蚂蚁森林，为支付宝的公益林浇水，给地球带来更多绿色。@微公益http://t.cn/RNDEOx1 ​​​我用@悦动圈 走了0步。已运动29天，共12.43万步。赞不赞？ http://t.cn/RNqg5NR ​​​我的微博等级达到Lv9喽！想想就有点小激动呢[太开心]小伙伴儿们快来看看你的等级好礼微博等级，升等级享好礼 ​​​我在#微博会员福利#中领取了【摩拜单车夏日礼包】。微博会员送福利，权益多多，你也来看看吧！>> ​福利权益免费领！ ​​​今天我的「微博等级」又升一级，记录一下我在微博的成就微博等级，升等级享好礼 ​​​我用@悦动圈 走了0步。已运动23天，共9.20万步。赞不赞？ http://t.cn/RC6z6Uh ​​​
洒一地阳光会幸福001,1,福建千里香燕皮大混沌诚招加盟商！保证是纯手工制作不掺假！联系电话18300729733 驻马店·古槐街区 ​​​
以太物88,5,看清身體印記，喚醒療癒密碼 Ⅱ●頸椎開始出現問題的時候，跟關節有很大的關聯，因為整個脖子裡面的僵硬，都是因為忌妒所引發出來的狀態....●沉默負重的肩膀與雙手背負了各種生活中的責任，到雙手的手肘裡面，整個雙手就是代表一個人對於責任放下、放心的程度....●為什麼有些人的皮膚會有斑點 ​​​ 全文　　在灵界和人世间，有一种「对映原理」，这世界中存在的物质，可以对映到灵界中无形的存在。自然界的太阳是灵界太阳所產生的……它只是替代品－－灵界太阳所散发的，灵流是灵界，灵人的生命之源，事实上，灵流自灵界到达自然界。人有灵人体和肉体，存在於肉体中的灵人体吸收灵流以此维持人类的生命！ ​​​ 全文http://t.cn/R9mhWJg人死后变成了灵人去到地狱的灵人－－是……那些看不到灵界存在的人，因為他们不瞭解自己的本心……他们不是如宗教所说，只因犯了许多恶行而去地狱，他们是自己选择去地狱的！这些前往地狱的灵人，在人世间时，忽略了真正属於心灵的本质，只关心经由物质、性、名誉和权力来满足肉体 ​​​ 全文来自地心世界的讯息— 科技 (我本人看到这段文字如同跟亲人一起在地心图书馆阅读资料 幸福的流下眼泪)科技促进我们的文明从地心世界向您问候。我是米可斯，你们来自地球内部的朋友。今天我们谈论地心世界的科技。在地心内部的我们技术都非常先进，所有这些技术都用来建设，而不是破坏我们的文明 ​​​ 全文http://t.cn/RWZYKVa只要該星球上的人不選擇獵戶帝國的政經體系，他們就不會棄之不顧。反之，大多數人類如果自願活在現在的經濟奴役和菁英軍隊警察治國的主奴體系(也就是獵戶帝國早在幾千年前就為原始部落派系設定的發展方向)，他們就不會再來，讓人類自己去體驗發生在獵戶帝國和其他類似星球的專制統 ​​​ 全文黄 ​​​真正的爱是从你里面自然涌现出来的喜悦，它没有原因， 也没有动机，只是去分享它所产生出来的喜悦。庄子为什么逍遥 就是因为爱 逍遥就是自在快活 ​​​http://t.cn/RWvote2　　这季的主题是关于振动频率的，我之前在第22季专门写过振动频率，这季我将会结合自己最新的研究和心得再深入写一下。触发这次写作灵感的是我最近看的一篇文章，这篇文章叫《我见过天堂》，地质学家阿瑟·严森1932年8月因车祸有了濒死经验，因此得到了轮回的知识与启示。这篇文 ​​​ 全文『當他人沒注意時，仍做對的事。稱之為「內外一致」。』1. 有管制自己負面的思、語、身之能力。2. 不以他人的看法來認識自己。3. 是個自我誠實者，外來的批評也影響不了他。4. 「內外一致」不是他的目標，那只是另一個外來的評斷。5. 是個覺察者，能覺察內在的人。他因能回歸自己的本質：靈魂 ​​​ 全文生命从来就不意味着劳苦工作和挣扎，而是喜悦与创造的旅程。 cobra ​​​
一块帮公益发起人,1,这个孩子从生下来爸爸离家出走，至今没有音讯妈妈生下她也离家出走，十二年了，就跟着六十多岁的奶奶生活，家境实在贫困，没有经济来源，仅靠着奶奶种着二亩农田相依为命，今天给孩子买了点吃的，花了99元，爱心人捐的内衣，给孩子600元 莱西·滨河路街区 ​​​【嘿嘿提醒：在评论区发表自己的独特观点有机会获得嘿嘿为你准备的惊喜福利哦~】诺贝尔奖跟你我有什么关系？还真有，而且关系大着呢！ 今日头条 http://t.cn/ROV6Wgf ​​​每天刷微信刷微博，你知道这背后意味着什么吗？ 今日头条 http://t.cn/RO2YB01 ​​​【没想到，美国赌城枪击案还能让中国人这样“躺枪”】（来自 @一点资讯）没想到，美国赌城枪击案还能让中国人这样“躺枪” ​​​【壮观！2000名学生军训场上演心肺复苏[威武]】近日，2000多名厦门医学院学生展示了军训成果。除了常规的格斗术、队列表演，他们还表演了心肺复苏和止血包扎等技术，独具医学院特色。一手video的秒拍视频 网友：值得分享，感觉人人都应该学！ ​​​【举着国旗通过交战区是杜撰？利比亚撤侨亲历者告诉你真相】边境关闭，手机通讯中断，怕被枪杀—“我想回家我要回家！”利比亚撤侨亲历者王本虎讲述6年前撤侨前后，证实《战狼2》情节：举着国旗通过交战区。到了边境，有的人护照丢了，就让他唱国歌，唱完就放行…人民日报的秒拍视频 @演说家speaker ​​​【“中国天眼之父”南仁东病逝 享年72岁[蜡烛]】国家天文台消息，“中国天眼”（FAST）首席科学家、总工程师南仁东因病，9月15日23时23分逝世，享年72岁。FAST是世界最大单口径射电望远镜，可接收137亿光年以外电磁信号。南仁东20多年“铸天镜”，没有他就没有FAST。致敬，送别！人民日报的秒拍视频 ​​​美国留学生在中国，中国留学生在美国，看完我对美国产生了质疑！局座张召忠与鲁豫在演说家担当评委。美国所倡导的民主，自由你们还认同吗？ 今日头条 http://t.cn/Rp8NGDN ​​​【每日头条】优质资讯精选，轻松知天下事 http://t.cn/Rpfx9F5，世界上任何地方都有其违宪违法的禁忌，从不存在绝对的、不用负责任的言论自由。禁忌可以源自宪政精神，也可以来自历史教训、文明观念。比如，德国不能宣扬纳粹，美国不能宣扬种族主义。就在上月，两名中国游客在德国柏林国会外做出纳粹 ​​​ 全文【每日头条】优质资讯精选，轻松知天下事 http://t.cn/Rp5jK3h ​​​
足彩NBA分析师-迪,10,群 231658753  进群暗号  888微博 ​​​足球 - 全场 滚球大小投注  [心]滚球推荐[心] 罗甲 01:45 12 维托鲁康斯坦萨 0-0 克卢日上半场1内大  重注#跟着大牛买足彩# #滚球体育# #足球体育# ​​​足球 - 全场 滚球大小投注  [心]滚球推荐[心] 葡超 01:15 6 塞图巴尔 0-0 马里迪莫上半场1内大  重注#跟着大牛买足彩# #滚球体育# #足球体育# ​​​足球 - 全场 滚球大小投注  [心]滚球推荐[心]  西丙2 23:30 62 米兰迪斯 1-1 布尔戈斯   全场3内大 #跟着大牛买足彩# #滚球体育# #足球体育# ​​​足球 - 全场 滚球大小投注  [心]滚球推荐[心] 阿尔甲 23:59 9 阿贝斯 0-0 巴拉特上半场1内大 #跟着大牛买足彩# #滚球体育# #足球体育# ​​​足球 - 全场 滚球大小投注  [心]滚球推荐[心] 法甲 23:00 中 摩纳哥 1-0 卡昂全场2.5大  可重#跟着大牛买足彩# #滚球体育# #足球体育# ​​​足球 - 全场 滚球大小投注  [心]滚球推荐[心] 英冠 22:00 69 诺定咸森林 1-0 保顿艾尔宾全场2内大  重注上车 #跟着大牛买足彩# #足球体育# #滚球体育# ​​​足球 - 全场 滚球大小投注  [心]滚球推荐[心] 德甲 21:30 63 奥斯堡 1-0 汉诺威96全场2大占位  补1.5大 #跟着大牛买足彩# #滚球体育# #足球体育# ​​​足球 - 全场 滚球大小投注  [心]滚球推荐[心] 意乙 21:00 62 比斯卡拉 1-1 艾维连奴全场3大占位  补2.5大   可重注#跟着大牛买足彩# #滚球体育# #足球体育# # ​​​足球 - 全场 滚球大小投注  [心]滚球推荐[心] 英冠 22:00 17 班士利 0-0 侯城上半场1内大  可重#跟着大牛买足彩# #滚球体育# #滚球体育# #足球体育# ​​​
不要焦躁nn,5,我啥时候中奖[允悲] ​​​#双十一任性宠粉# [微风]10W.10W.10W现金送2898个[doge]狗子们！！转发+关注@种草达人买买酱 和 @元气种草达人 11月1日零点第一波 抽111个111元现金 11月5日抽111位每人111元现金11月7日抽111位每人111元现金11月9日抽111位每人111元现金11月10日19:00最后一波 抽1位4999元和11位每人1111元你 ​​​ 全文天有点冷了 别着凉了抽1000块钱去买件衣服吧后天就开 这次不过滤僵死粉在不中我也没办法了啊转发关注就行 @微博抽奖平台 ​​​【继续放大招】iPad一部，让你边看教程边学做菜，早日成为大厨！希望你们喜欢~ [害羞] ​​​简单点，转+关注，明晚11点半抽一人4999！！然后还有今晚11点半转发里抽300人两块，赞里抽100人8.8，评论抽100人8.8.还不中的别灰心，请狠戳http://t.cn/ROkuuKJ这里今晚零点开始到11月11日，都有红包可抽，最大有1111。。@微博抽奖平台 另外通知，从现在到双十一，我的抽奖不会断，双十一当天会抽 ​​​ 全文抱歉，此微博已被作者删除。查看帮助：http://t.cn/Rfd3rQV今日迷信，明天会收到一笔意外之财。 ​​​结尾有大大大彩蛋(送4221元现金)！！！！！双11红包来啦，今晚0点可以领取，最大有1111元！双11红包入口：http://t.cn/ROF7u3U 淘口令：￥cmXk05ivsX0￥ ​​​(图3有领取和使用规则)(大彩蛋：转发此微博并关注我@白菜剁手菌 今晚0点后抽3个送111元，11月11号0点抽3个送1111元，5个送111元) ​​​搞！事情！啦 ！！！[吃瓜]这次准备了 iphone X + 美图m8 + 索 尼 + 口红转发关注我 + @白菜省钱君 就可以啦啦啦详细看图1 ！！ 11.3 开  @微博抽奖平台 快转吧[羞嗒嗒] ​​​转赞评，各抽一个送1000元红包！后天就开！双十一剁手红包来啦，零点开始，有1111元啊啊啊。 双十一红包入口，先码走，零点开始，今年好多1111元！入口：http://t.cn/ROkjs0J淘口令：￥BYFA05ie3oK￥ ​​​抱歉，此微博已被作者删除。查看帮助：http://t.cn/Rfd3rQV
灰原的帽子,7,买品质货找我就对了！卖的是高的性价比http://t.cn/ROj7d4c ​​​，下单前先了解购买须知和产品须知[太开心] ​​​不接急单。 ​​​买品质货找我就对了！卖的是高的性价比http://t.cn/ROj7d4c ​​​，下单前先了解购买须知和产品须知[太开心] ​​​不接急单。 ​​​买品质货找我就对了！卖的是高的性价比http://t.cn/ROj7d4c ​​​，下单前先了解购买须知和产品须知[太开心] ​​​不接急单。 ​​​买品质货找我就对了！卖的是高的性价比http://t.cn/ROj7d4c ​​​，下单前先了解购买须知和产品须知[太开心] ​​​不接急单。 ​​​买品质货找我就对了！卖的是高的性价比http://t.cn/ROj7d4c ​​​，下单前先了解购买须知和产品须知[太开心] ​​​不接急单。 ​​​买品质货找我就对了！卖的是高的性价比http://t.cn/ROj7d4c ​​​，下单前先了解购买须知和产品须知[太开心] ​​​不接急单。 灰原的帽子的秒拍视频 ​​​买品质货找我就对了！卖的是高的性价比http://t.cn/ROj7d4c ​​​，下单前先了解购买须知和产品须知[太开心] ​​​不接急单。 ​​​买品质货找我就对了！卖的是高的性价比http://t.cn/ROj7d4c ​​​，下单前先了解购买须知和产品须知[太开心] ​​​买品质货找我就对了！卖的是高的性价比http://t.cn/ROj7d4c ​​​，下单前先了解购买须知和产品须知[太开心] ​​​买品质货找我就对了！卖的是高的性价比http://t.cn/ROj7d4c ​​​，下单前先了解购买须知和产品须知[太开心] 不接急单 ​​​
暮礼Smile,10,说大话的人是不知道天高地厚的人，直到有一天，说大话的人挨了雷劈才知道原来自己不该说大话。                                                                  ————暮礼Smile晚安：）朋友们，祝您美梦成真！[拜拜][拜拜][拜拜] ​​​金牛女问自己的妈妈：“妈妈，你为什么生下我来是金牛座？”金牛女妈妈回答女儿：“对不起！孩子，妈妈也曾用同样的话问过你姥姥。”[哈哈][哈哈][哈哈] ​​​假如你爱上一个金牛女孩，想搞定她，那么最好的方法就是先搞定你自己，数一数你有几套房子，几辆车子，几张银行卡。[微笑] ​​​有时候，脑袋冷静，就觉得自己应该对自己好一点，但是，有时候，在疲于奔波忙碌的时光里，脑袋就变成了一缕透过树叶的光，一直在燃烧…                                                                        ————暮礼Smile ​​​别以为开玩笑就只是开玩笑，其实，玩笑话里藏真心，只是愚昧的人把它当作玩笑一笑而过而已。                                                                        ————暮礼Smile ​​​内心深处的悲伤是无法用任何方式掩盖的住的，强颜欢笑是很难看的。                                                                   ————暮礼Smile ​​​狮子男和白羊女结合的话，注定狮子男永远摆不过白羊女，狮子最后会甘败下风，是好一辈子乖乖听白羊的调遣。[允悲][允悲][允悲] ​​​水瓶男对射手女说：“你要懂得我爱你的方式，那就是在我需要你的时候你必须就在我身边，除我之外，你不要有其他男朋友。”[允悲][允悲][允悲] ​ ​​​想问女同胞们一个问题：为什么狮子女事业有成婚姻失败呀？[摊手] ​​​妈再跟你说一遍，你这个不争气的小双鱼崽子，你再这么搞外遇，你的这两个小双鱼崽子妈是不给你看了，臭小子……[坏笑][坏笑][坏笑] ​​​
瑛梓鄧Tina,6,愿佛祖佑护吾亲友远离一切灾厄，平安、健康、吉祥！ 国泰民安！阿弥陀佛[祈祷][祈祷][祈祷] 韶关·南华禅寺 瑛梓鄧Tina的秒拍视频 ​​​平凡，不意味着不成功。就像小草，虽没有大树挺拔，却同样以自己的力量装点着大自然。昔日，杜鲁门当选为美国总统时，有记者去采访他的家人。他弟弟朴实地说：“我为哥哥而感到自豪，他将是美国最优秀的总统之一。但我也同时为自己感到骄傲，我是一名农夫，我用自己的手养活自己，照顾父母。”所以， ​​​ 全文喝茶只需两个动作——拿起和放下。人生亦如喝茶，虽看着繁杂，其实又何尝不似如此简单？有些事何必纠结于心？有些人何必纠缠不清？很多时候，看淡一些，看轻一些，世事原本可以像喝茶一样，不过拿起和放下罢了。 ​​​​人无病不知痛，人无伤不知悲，人无苦不知离，人无恨不知恕。因果昭昭，世事循环，天下万物，不外此理。 ​​​​生命中，相遇的人很多，相知的人并不多；生活里，相识的人很多，相依的人并不多，大千世界，并不是缺少一个说话的朋友，而是渴望一个理解自己，读懂自己的朋友，芸芸众生，并不是没有相识的朋友，而是渴求一个适合自己，体会自己的朋友。假如，生命中，有这样一个人出现了，你一定记住一个词：珍惜！ ​​​在你绝望的时候帮你的不一定是你的同伴，也许是一个的陌生人方子强的秒拍视频 ​​​倚楼听风雨，淡看江湖路。 ​​​我很喜欢你 可是好像只能到这里了[微笑] ​​​​一直觉得这世界上的告别仪式挺多的，比如喝一场大酒，来一场旅行，或者情不自禁的在车站大哭一场。可是后来才知道，人生中大部分的告别是悄无声息的，甚至要很多年后自己才明白，原来那天的相见，竟然已是最后一面。此后即便不是隔山隔水，也没有再重逢。于是和一些人拥有过的美好，到最后 ​​​ 全文从今往后，以朋友之名，深爱、占有、不分手。                                                            ❀ 坎话 ​​​
时装达人168,6,套头高领毛衣女秋冬季加厚韩版百搭宽松可爱学生外穿2017时尚新款【包邮】【在售价】109.00元【券后价】49.00元【下单链接】http://t.cn/RWL8j0z-----------------复制这条信息，￥VeWX05FbZdX￥ ，打开【手机淘宝】即可查看 广州·大石 ​​​毛呢外套女中长款韩版2017秋冬款加厚学生妮子斗篷牛角扣呢子大衣【包邮】【在售价】158.00元【券后价】128.00元【下单链接】http://t.cn/RWL8JEF-----------------复制这条信息，￥gpvb05F0IW9￥ ，打开【手机淘宝】即可查看 广州·大石 ​​​2017秋冬季新款韩版ulzzang宽松连帽卫衣女中长款套头上衣连衣裙【包邮】【在售价】59.00元【券后价】39.00元【下单链接】http://t.cn/RWL8b1a-----------------复制这条信息，￥sLwP05F0PGm￥ ，打开【手机淘宝】即可查看 广州·大石 ​​​2017春秋装新款韩版宽松百搭连帽套头卫衣女薄款外套假两件上衣潮【包邮】【在售价】49.90元【券后价】29.90元【下单链接】http://t.cn/RWLQBim-----------------复制这条信息，￥4Ts205FZqEE￥ ，打开【手机淘宝】即可查看 广州·大石 ​​​黑色打底裤女裤外穿秋冬季2017新款韩版百搭秋季紧身小脚铅笔长裤【包邮】【在售价】59.00元【券后价】29.00元【下单链接】http://t.cn/RWLQNd0-----------------复制这条信息，￥JNcL05FZRc1￥ ，打开【手机淘宝】即可查看 广州·大石 ​​​上班族和久坐族的必备的21种按摩手法！学会了可以造福对象，也可以转给另一半让TA学会了帮你按，按完之后会非常的舒服！不过要注意力度和安全哈~[太开心]每天按摩15分钟，身材不臃肿，体重控制2位数！赶紧来试试[来]全球健身中心的秒拍视频 ​​​2017秋冬季新款女装纯色套头长袖打底针织衫罗纹宽松圆领时尚毛衣【包邮】【在售价】179.00元【下单链接】http://t.cn/RWZzJXQ-----------------复制这条信息，￥lRaH05Ks9S9￥ ，打开【手机淘宝】即可下单 广州·大石 ​​​港欧时力代2017新款冬季女装宽松羊毛呢双面呢大衣外套2JM4340680【包邮】【在售价】599.00元【券后价】579.00元【下单链接】http://t.cn/RWZz5eQ-----------------复制这条信息，￥OR6r05KsYUr￥ ，打开【手机淘宝】即可查看 广州·大石 ​​​摩安珂馨妮2017冬季女装新款复古高腰拉链A字半身裙MA174SKT101【包邮】【在售价】169.00元【下单链接】http://t.cn/RWZzbhG-----------------复制这条信息，￥NyFz05Ks1A9￥ ，打开【手机淘宝】即可下单 广州·大石 ​​​港欧时力代2017新款女秋冬猫咪卡通贴布棉铅笔牛仔长裤1JY3066110【包邮】【在售价】199.00元【下单链接】http://t.cn/RWZzwzY-----------------复制这条信息，￥qFqm05KIui7￥ ，打开【手机淘宝】即可下单 广州·大石 ​​​
速改师,1,#探出小脑袋# 这样的下雨日，让我的心里好堵塞，因为好闲，人一闲下来就要想好多事情。我是速改师在这个时候与大家分享一下。今天卡奴怒袭广东省，让我觉得人生中不就是这样吗？说不定什么时候，什么地点，就会有一种强有力的冲击力向着你袭来，这个时候我们要做到的就是未雨绸缪。那怎么样才能做到囊 ​​​ 全文#今日贴纸打卡# 又到了速改师为大家小小改变的时候了，有没有很期待啊。今天要给大家分享的就是不要因为自己的状态不好就让自己懈怠。其实每个人都有状态不好的时候，但是能让自己的状态不好的时候都做的比别人好，这样的你还怕把自己不够强大吗？我是一个篮球教练，我让孩子们快乐的时候也把自己得到 ​​​ 全文#宝宝的小情绪# 又是一次发文站，今天给大家分享的是当爱情要离开的时候你应该怎么改变。现在的社会不能在一起的爱情多不胜数，因为家庭，因为金钱，因为陪伴，因为距离。仔细想一想这些莫不是找出来的借口吗？当一个人真的爱你，选择你的时候这些就早已经明白了。到最后分开，其实也就是因为她本来就 ​​​ 全文#你好老铁# 如期而遇的发了这样的微博，我是速改师，很高兴自己给自己一个这样的称谓。不知道大家发现没有，社会有时候很公平，有时候却很捣蛋。他把本来属于你的东西却让你费很大的力气才能得到。就像爱情一样，在这个物质社会横流的年代，保持住自己的那份爱情真的很难，但是你又不想放弃去找和你差 ​​​ 全文#今日贴纸打卡# 今日的晨光让我们又要改掉之前的懒散，精神焕发的迎接现光。如何改变自己，从现在做起[微笑][太阳] ​​​#生活如诗#曾经想过繁华如星的将来，曾经想过手牵手走到白头的夜晚，曾经更想过环游世界的时候还有你陪伴在我的身边，可这一切的一切却都是想过。现如今走在没有尽头的夜马路上，想着自己如今的生活，只不过是一种过渡，幸好没有……。躺着的时候遐想，睡起来了就奔波。这个时候我只想告诉自己，所有的 ​​​ 全文快来看超高人气单图《我奥》http://t.cn/R6XPtML（分享自 @人人网） ​​​静静的我离开了，但是回来的时候我要经天动地 ​​​时间总能让真正的人在一起【【夏日么么茶】《裸婚时代》动人剧情】 《裸婚时代》动人剧情 ​​​施恩遭怨【【电乐乐】富家女嫁给穷小子，4年穷小子翻身怒离婚，富家女失控大哭】 富家女嫁给穷小子，4年穷小子翻身怒离婚，富家女失控大哭 ​​​
