Nanade小世界,1,【  九月好事连连 …  】 ​​​
小马啊过来,6,如果他不是你爹，把这么高危的病人不留在急诊，不派人盯着，扔病房门口自己不管不问上手术去了。给你上个医生对人命冷血漠视的新闻头条也是妥妥的。倒霉就倒霉在他是你亲爹。 ​​​【闲不住！杭州大妈家年入60万住别墅开豪车 坚持做清洁工】#杭州身边事#早上6点多，入秋的杭州有些微寒。住在临平附近的汪阿姨已经赶到人民广场，开始埋头工作。这份从早上6点到下午2:30的工作，可以为她带来50元的日薪。常年风吹日晒，阿姨手很干，天冷时还开裂。儿子想不通：家住5层洋房，出入有车接 ​​​ 全文这要是被男朋友看见，这些姑娘还能嫁出去吗？[笑cry] 搞笑补习班的秒拍视频 ​​​【郁金香之国：世界“农业硅谷”】新晋农业巨头荷兰正在改变我们生产粮食的方式。荷兰是世界第一土豆、洋葱出口国，全球超过三分之一的蔬菜种子贸易出自荷兰。荷兰的出口粮食创收额仅次于美国，可用土地却只是他国的零头。它是怎样获得如此成就的？是依靠其超高效的农业科技[good] http://t.cn/RODg3fA ​​​#科学荟萃#【想睡好请起早！别管睡多晚】从事睡眠研究的北京大学第六医院院长陆林近日分享了一些睡好觉的办法。第一个原则，是别贪睡晚起。陆林说，许多人熬夜后，会选择晚起几个小时补觉，这是错的。“你习惯6点起床。有次晚睡了4个小时，你决定10点再起。结果是后面几天都睡不好。”陆林说，“应该照 ​​​ 全文吐个槽。每次点开一个二哈视频，都有好心人来提醒这是阿拉斯加，点开一个阿拉斯加的视频，又有人来提醒这是二哈，每次看一个自然科学的视频，底下评论不用看了，必定有薛定谔的猫。每次看一个社会新闻，必定有人说何不食肉糜。。。。。。。。明明记得有好多的，，，[doge]以后补充 ​​​【99.99%的人都没读懂“此情可待成追忆” 】台大中文系欧丽娟教授说，大多数人都会把李商隐的诗理解为，这些感受可以等日后成为追忆，但这种理解是现代人的一厢情愿——我们把自己看成是宇宙的中心，才会用自己的标准来衡量世界、衡量经典，而好的读者应该超越自我，让微小的自我容纳更多的外在世界。  ​​​ 全文在你#绝望#的时候帮你的不一定是你的同伴，也许是一个未曾相识的陌生人！看的好揪心，最后好感动！[心] 我的损友是个极品的秒拍视频 ​​​[允悲][允悲]当蜘蛛侠在乡下…… ​​​十多年前我们都在听什么歌？来看看05、06、07年华语乐坛的每周冠军单曲都有哪些。满满的都是回忆啊~那个曾经的黄金年代，每周都有很多好听的新歌，那些歌填满了我们美好的学生时代。八哥专用的秒拍视频 ​​​
zhcs神,1,【杭州纵火案保姆将被起诉】支持，盼严惩。同时，我想知道事发之后救援不力的物业管理方该承担何种责任？介绍这个嗜赌如命、劣迹斑斑的保姆的中介机构该承担何种责任？我发起了一个投票 【来投一票】来投一票 ​​​该微博因被多人举报，根据《微博社区管理规定》，已被删除。查看帮助：http://t.cn/Rfd14WY本来是儿女围绕，而现在留下孤单的背影，[泪] ​​​孩子们，你们今天好吗？杭州下了一天的雨，是你们想念爸爸的眼泪吗？还是妈妈在搂着你们绝望的哭泣？孩子们，你们有没有走远？能不能听到爷爷奶奶外公外婆崩溃的哀恸？能不能看到爸爸无神的沉默？伯父姑姑舅舅的寝食难安，玩伴们的惊恐迷惑。。。你们都知道吗？我们今天见了很多邻居叔叔阿姨 ​​​ 全文
笑笑乐乐976,3,新鲜大闸蟹继续简单 2母10只198元   2.5母10只298元  3母10只398元（公蟹没有完全好吃暂不推荐）预定的可以发货了 ​​​自产自销，价格比市面上便宜，需要的联系我[作揖][作揖][作揖][微笑] ​​​金秋时节，螃蟹收获季节，自家养殖，肉嫩膏满，需要的联系我[微笑][微笑][作揖][作揖] ​​​【杭州纵火案保姆将被起诉】支持，盼严惩。同时，我想知道事发之后救援不力的物业管理方该承担何种责任？介绍这个嗜赌如命、劣迹斑斑的保姆的中介机构该承担何种责任？我发起了一个投票 【来投一票】来投一票 ​​​@司马3忌 @贼叉 @地瓜熊老六 人民警察部队要是来抓你们怕不怕啊[允悲][允悲][允悲] ​​​我分享了 @让人世间充满爱 的头条文章 杭州纵火案之公道解说 ​​​我能在人群中如此闪耀，全因有你们的支持、鼓励和陪伴！感恩有你们！[爱心] ​​​#超级话题#，我是第31个申请开通#巨婴王国#超级话题的粉丝，还差69人就满足申请条件啦！大家快来帮我加快开通速度吧~http://t.cn/R9ceaUZ ​​​发布了头条文章：《杭州纵火案解决之道：政府，请治绿城“肇事逃逸”之罪》  #老婆孩子在天堂622# #绿城还逝者公道# #潼臻一生##朱七七# @朱七七Fighting @Ann__橘子 @一毛不拔大师 @郝劲松 @徐冠华1 @周鸿祎 @A-戴丞 @司马3忌 @楚江恬 @朱庆丰57265 @巨婴国王 @老子突突了你 @胖天半斤 @大脸撑在小胸 ​​​ 全文我发表了头条文章:《林生斌：你的巨大苦痛，之于宋卫平及绿城人，能算什么！》 林生斌：你的巨大苦痛，之于宋卫平及绿城人，能算什么！ ​​​
用户ovt8m7x9c7,1,一套贴心的儿童科普书。韩国童书畅销作家白明植的重磅作品。《亲子美食之旅》。小盆友知道水果能产生电流吗？叫得出身边的蔬菜和千姿百态的野菜名字吗？见到鱼贝虾蟹会大眼瞪小眼吗？想探索米饭背后的秘密、一锅做出软硬两种米饭吗？水果、蔬菜、海鲜、米饭，爱上好书，爱上吃饭！http://t.cn/RADeSdd ​​​
asonquoi,6,"用微博好几年了，我知道有很多敏感脆弱，容易感伤的朋友关注我，经常看到你们的私信评论，不知道该怎么回复。也这么多年了，如果我能让你们意识到活得没皮没脸一点儿也没什么，人是可以开心起来的，就算我的回复吧。开心点朋友们，人间不值得。 ​​​【八组热议】袁泉的这组照片，真的是高级美啊，这个气质，服了[跪了] ​​​家有大狗，一抱解千愁！[憧憬] ​ ​​​W Concept 销量冠军——Evanlaforet家的羊绒大衣！最显肤色的灰棕色，时髦的廓形，版型超级赞！双排扣设计显得特别高级！里面还是加绒的，保暖度绝对高！现在限时折扣+限时免运http://t.cn/R04t93Y，类似的Andersson Bell：http://t.cn/R9AMJcr，Collaborory：http://t.cn/RO9SBTX，Moontan： ​​​ 全文Zuhair Murad Resort 2018 ​​​proenza Schouler hava七折<可直邮中国>http://t.cn/RWzdW9v ​​​#Events# Karlie Kloss - Bumble Dinner Party, New York 19.10.2017 ​​​爱情这东西真是甜 [心] ​​​好久没抽奖来那个一下！祝大家在冬天也瘦瘦的很可爱！！请大家吃火锅！咕咕咕！大大后天开！转发里开～平台开～ ​​​关注我和@白菜 ，转发中抽取六位朋友送：1. 粉色 Celine box 一只2. MacBook 一台3. iPhone X  一台4. Tomford 唇膏50支礼盒套装5. 拍立得 粉色Mary Kay 一台6. Kindle paperwhite 一台均可折现。大家冬天快乐❄️ ​​​"
十分钟过客,3,#天狼月季福利#  转发+关注，抽取三位粉丝送出瑞典女王大苗1棵。[小黄人高兴]瑞典女王，是奥斯汀非常优秀的一款丰花灌木品种。它的美，不用多说，想必很多花友都知道。——粉色的包子花型，圆润饱满；它四季开花，春季开花效果惊艳；抗病性强，无论是盆栽还是地栽开花量都非常大，适合新手。【天 ​​​ 全文别人家养的棉花糖，大概是成精后的棉花糖完全体了。看着太诱人了，想撸想摸想抱[憧憬](ins:jinju_bichonfrise)英国报姐的秒拍视频 ​​​这脸撞的。ab出演二三四[思考]#宝宝的小情绪##探出小脑袋##宝宝很方##今日贴纸打卡# ​​​#天狼月季福利#  转发+关注，抽取三位粉丝送出瑞典女王大苗1棵。[小黄人高兴]瑞典女王，是奥斯汀非常优秀的一款丰花灌木品种。它的美，不用多说，想必很多花友都知道。——粉色的包子花型，圆润饱满；它四季开花，春季开花效果惊艳；抗病性强，无论是盆栽还是地栽开花量都非常大，适合新手。【天 ​​​ 全文#今日贴纸打卡# ​​​上午听报告，中午烫火锅，下午看书略枯燥。#今日贴纸打卡##鸡智如我##主题依旧是别人自己##统治与教育：从国民到公民-徐贲[图书]# [晕][晕][晕] ​​​【乔任梁追思会暨落葬仪式举行 好友陈乔恩王睿到场】今日上午9点，#乔任梁#追思会暨落葬仪式举行，现场摆满粉色气球，好友#陈乔恩# #王睿#等到场，今天也是乔任梁30岁冥诞，众好友为他点燃了生日蜡烛。 ​​​同是国人抗日，数十万的牺牲隐藏或者一笔带过，歼敌1000浓墨重彩，被欺负的时候敢于承认弱小，需要正面意义的时候又成了中流砥柱。通告全国举起旗帜究竟是有多大作用？？            ——教科书有感 ​​​饭前反思。如果脑机接口发展到影厅不止输出音乐，升级成直接输出情感，艺术创作意义何在？ ​​​#探出小脑袋##今日贴纸打卡# 敢于发挥自强不息的“长征”精神，拿出找工作一半的力气，八竿子打来的亲戚也是能抢到巨款的[doge][doge][doge] ​​​
冷芸时尚,5,我在#微博问答#，等你来问～有什么想问的，快来问吧，我一定知无不言，言不无尽！微博问答，让知识有价！ ​​​#TPM Art# Matthew Brannon at David Kordansky ​​​发布了头条文章：《读《时尚与其社会属性：阶层，性别与身份表示》》我们接下来要阅读的第14本书，是《时尚与其社会属性：阶层，性别与身份标识》。前两天伦敦皇家艺术学院一个朋友问我，为什么在国外来关于时尚/服装类的学术会议'很少见到来自中国的学者？因为，我们实在是没有几个人在研究时尚理论。 ​​​ 全文#冷芸时尚线下买手课# 我们线下买手课第2期今日开课了！我做了线上以及线下培训后，就相信了一点，有一样东西是智能机器人永远无法替代的，那就是人类的情感！线上对于无法受时间与空间限制的人来说是个不错的选择。但如果有选择的情况下线下是更好的选择。彼此间的互动与情感交流，是线上无法给的。 ​​​#买手微课#发布了头条文章：《第2期线下买手课即将开课（上海）名额有限》 第2期线下买手课即将开课（上海）名额有限 ​​​丽人丽妆的黄总说，兰蔻去年在中国超预期增长，所以，他们在双十一采用了封顶销售，就是卖一个亿不再卖了，否则春节柜台没有货。兰蔻有什么产品这么受欢迎啊？忘了问。 ​​​#BoF每日速报#【Nordstrom暂停公司私有化进程】更多要闻：http://t.cn/RWPvaov 美国百货Nordstrom Inc表示，由于在关键的假期购物季前很难安排债务融资，创始人家族已经暂停了公司私有化的进程。受次消息影响，Nordstrom股价下跌7％至39.64美元，为五个月来的最低。Nordstrom在6月份曾表示，拥有该公司 ​​​ 全文给范冰冰等一线明星做了15年的造型师，有什么穿着秘笈要分享给你？ #冷芸时尚圈##时尚观点# ​​​再次感谢《Newstar 潮星》出版人 顾蒨的邀请 ！认识了一群那么优秀的新朋友！这张照片我喜欢，期待更多官方照！ ​​​下拉菜单到设计师，听@范冰冰 @黄晓明 @angelababy 等一线明星的长期造型师@张帅VlP 的采访。这是我这期做的最刺激的一场对话。一定要听听！虽然好多人觉得时尚很浮夸（有一定道理），可是这个行业之所以让我热爱，就是因为这里是真正可以百花齐放，百家争鸣的地方。多姿多彩的人物，文化大杂烩式的时 ​​​ 全文#职业规划# 发布了头条文章：《都说“实践出真知”，那么读书的意义究竟何在？》 都说“实践出真知”，那么读书的意义究竟何在？ ​​​
哈喽影先生,5,"【电影特效前后对比图】人生如戏，全靠演技[允悲][允悲] ​​​​美国西部脱力爆笑短片《快枪手》：史上最牛旁白，各种反转反套路，笑出猪叫！[笑cry]电影Mark的秒拍视频 ​​​#不能说的秘密# 最适合郑州的下雨天 郑州·动物园（商圈） ​​​电影放映前的中国梦系列宣传片大家都多多少少看到过吧？昨天发了图片，今天分享个视频大合集吧，成龙、吴京、达康书记、赵丽颖、杨洋、王俊凯等众多明星参与，印象最深的是甄子丹那句“雄关漫道曾如铁，鹅今迈步从头越”哈哈哈哈哈，众演员台词功底高下立见！ 根正苗红的贫农的秒拍视频 ​​​王牌特工2：黄金圈[星星][星星][星星][星星][半星]，节奏感和第一部没差啊，配乐打斗燃到爆！可能是因为审美疲劳的原因，惊喜不是很大！大boss死的太弱，不过，整体值得看！ 郑州·动物园（商圈） ​​​如何让电影变奇怪 ​​​#奋斗#还记得十年前观看这部电影时的心情吗 ​​​【80后们：“中年人”这个称谓，你真的接受吗？[允悲]】第一批80后已经37岁。最后一批也满满28岁，即将跨入三十并""奔四""的行列。你们还好吗？这是一个不太友好的年份。因为在当今中国，80后已被互联网统称为“中年人”，象征着菜米油盐酱醋，象征着重压下的琐碎生活。然而，你们的前半生可不是这样的。 ​​​ 全文GIF中加入两条竖线，图片里的人物移动遮盖住白线的时候，就会产生3D效果，这一波很好玩了～～ ​​​​（英国那些事儿） ​​​#彭于晏# 不管怎样都祝福[二哈][二哈][二哈]不然，我TMD的能怎样 郑州·动物园（商圈） ​​​"
Ivy一昂,2,不完整截图华大基因 ​​​堺雅人[下]🏻松田龙平（松田翔太也可以，但是我还是喜欢比较正气的） ​​​#疯狂打Call# 搜了一下，“打Call(コール)，是日本演唱会Live应援文化之一。为了表示对台上偶像歌手的肯定，粉丝们跟着节奏挥舞荧光棒、喊加油打气，一起打造热烈的气氛。两个字说透就是：加油!”  不知道跟风爱说“打Call”的有多少人知道“コール”，又有多少是仇日的？ ​​​分享圖片  《区别》 ​​​#陈国富周迅陈坤# 共同创办#山下学堂# ，这是一次从表演开始的探索，也是一个打破教育常规的实验。我们和你一起分享、再创造。山下学堂现已开启报名，官方网站：www.shanxiaxuetang.com 山下学堂的秒拍视频 ​​​[10.15发布][日菁]2017秋季SP -  世界奇妙物语 2017秋季特别篇[岩田剛典/吉岡里帆/中山美穂/浅利陽介/藤原竜也/飯豊まりえ][繁体中文字幕][HDTV-MP4]http://t.cn/ROY7lkb ​​​大紧赶紧来@高晓松 证明这事是真是假朋友圈都刷屏了[摊手] ​​​能保留几百年的传统应该也是不多吧经过历史的检验，大概离真理不太远 ​​​
三秋鱼目,2,到洛阳了，开心，又吹到了北方的风。北京的风不能算，太不萧条。 ​​​时间不能抹平一切 忘记也不能代表没发生过 ​​​不用提心吊胆，也到处说这是一种解脱，可再也没希望了不是么。 ​​​以后起床的闹铃就它了 分享单曲 Out Of Limits (LP Version) ​​​想努力活一活 ​​​承认昔日的傻逼并不代表今日不傻逼。 ​​​一个劳动者，对一座没有好早饭或好夜宵的城市，很难建立基本感情。好早饭与好夜宵兼备者，堪称完美都市。由此，广州完美，重庆兰州亦是。沪宁苏锡常，杭州福州武汉，早点丰盛。所有有例行早点（热干面重庆小面拉面）的城市，最易使人亲近，让人依恋，难以离去，那几乎是共同的仪轨，在地者的密码。 ​​​昨晚直播，听了一个浪漫故事。男孩女孩相识于音乐节，前后交身时，一方偷偷记下微博。私信交流，发现对方都喜欢My Little Airport和黄要明。指尖交换过网易云，谈天论地，不知太阳已经升起的日子，断续一年。相约再见，女孩问男孩：“现实中的我，和网上的我有什么区别？”男孩说：“你原来是我 ​​​ 全文啥破节啊 一个人过也就拉倒了 手还烫掉层皮 ​​​看画有风险，点开需谨慎！[二哈][二哈]从餐桌边开始，在飞机上画，在机场候机时画，在大西洋西岸画，在太平洋东岸画，一直画到朋友家的餐桌边才画完。[心][心]这朵香气袭人的野玫瑰，漂洋过海来看你。[爱你][爱你] ​​​
sundetang6306647916,2,基因才是本质，其他都是表象。选择太多，则需要付出时间成本。 ​​​你能保证18亿亩，能保证18亿亩上都是粮食吗？ 潍坊·望留街区 ​​​面个试，冻死人啊 ​​​分享图片 ​​​我免费围观了 @ETF拯救世界 的回答，问题价值 79.00 元，快来一起免费围观~ 微博问答:“E大，不知道计划中还没有买入的资金你是如何运作的。如果只买货基是不是收益率太低了？请问有什么比较安全同时又收益高一些的投资品种，以及你操作闲散资金的策略。”谢谢 ​​​#志同道禾# 美国种植了海量的玉米，其中大约90%是转基因玉米。这些玉米中的绝大部分，不是种给人吃的，而是给集约化养殖场里的动物吃的[吃惊][吃惊][吃惊]...玉米不仅作为动物饲料，还被制作成生物塑料。下面↓↓↓要讲的，就是美国大规模生产的玉米对生态环境的影响… 绿色和平的秒拍视频 ​​​设想这样两个场景：1.坐车的时候，你发现丢了50元钱，这时你还会按照原计划去电影院花50元钱看吗？2.坐车的时候，你发现几天前花50元预购的电影票丢了，这时你还会继续去电影院重新花50元钱看吗？这个问题你会怎么选？答案与本次#诺贝尔奖# 经济学奖的获奖研究大有关系！#2017诺贝尔奖#  ​​​ 全文【《人类简史》作者尤瓦尔·赫拉利TED演讲】人类为何能成为地球的“掌权者”？仅仅是使用工具的能力，并不能说明为什么智人能够打败其他灵长类动物成为主宰，更重要的是一种团结协作的“共鸣”的能力。这种能力来源于哪里？听他阐述对人类社会过去和未来的深刻思考↓人民日报的秒拍视频 ​​​支出瀑布 上行下效 牛奶可乐经济学 ​​​不是所有的球都会弹起来的 ​​​
章茴petrichor,2,在深圳只呆了48小时不到也不能阻止我做一个地域黑啊在深圳，赚钱是唯一的正经事 ​​​最新一期封面，再次证明了《纽约客》是世界上最好的杂志之一。 ​​​#大王睡了#晚安周一(乙巳月 壬寅日)。愿望交给锦鲤们，你只管努力就行，握鳍。*。Ｏ。ｏ〇。〇Ｏｏ。*Ｏｏ。*。ｏｏ。*Ｏｏ。*。ｏ。*Ｏｏ。*。ｏ。*Ｏｏ。* ​​​#大王睡了#晚安周六(乙巳月 庚子日)。愿望交给锦鲤们，你只管努力就行，握鳍。*。Ｏ。ｏ〇。〇Ｏｏ。*Ｏｏ。*。ｏｏ。*Ｏｏ。*。ｏ。*Ｏｏ。*。ｏ。*Ｏｏ。* ​​​​ （图:@ONEDAY-易天 ​​​#大王睡了#晚安，为512祈祷。愿望交给锦鲤们，你只管努力就行，握鳍。**。Ｏ。ｏ〇。〇Ｏｏ。*Ｏｏ。*。ｏｏ。*Ｏｏ。*。Ｏｏ。*。。*。Ｏｏｏ。*。ｏ〇Ｏｏ。*ｏ。*Ｏｏ。*。ｏｏＯｏＯ。*Ｏｏ。ｏ。*Ｏ*。ｏ。*。ｏＯｏ。ｏ。*Ｏ*ｏ。*。Ｏｏ。*。ｏ。*。Ｏｏ。*。ｏ。*Ｏｏ。*。ｏｏ。*Ｏｏ ​​​ 全文#大王睡了#晚安周三(乙巳月 丁酉日)。愿望交给锦鲤们，你只管努力就行，握鳍。**。Ｏ。ｏ〇。〇Ｏｏ。*Ｏｏ。*。ｏｏ。*Ｏｏ。*。Ｏｏ。*。。*。Ｏｏｏ。*。ｏ〇Ｏｏ。*ｏ。*Ｏｏ。*。ｏｏＯｏＯ。*Ｏｏ。ｏ。*Ｏ*。ｏ。*。ｏＯｏ。ｏ。*Ｏ*ｏ。*。Ｏｏ。*。ｏ。*。Ｏｏ。*。ｏ。*Ｏｏ。*。ｏｏ。*Ｏｏ ​​​我默默盼望那天的到来，超市结账的时候只要一个袋子，我们一同拎回家。 ​​​好久没这样睡到自然醒，绵长又深沉的睡眠，醒来觉得系统宛如刷新过一般。意识到这点后，疯狂搜索关于那场爱情的文件名称。希望那有存档，不是一场大梦。 ​​​为你我愿意放弃英雄梦想。 ​​​我来分享一个生活小贴士，一点科学依据都没有，但是神准。如果你喜欢一个人，你谁都不能告诉，你告诉的人一多你俩就好不上了。如果你想做一件事，做成之前也不要大肆宣扬，否则就很难做成了。大家回忆一下自己的人生，摸着胸口告诉我，情况是不是就是这个情况。 ​​​
oolongtea凤凰乌龙茶人,8,"喝茶越久，越喜欢一个人喝一个人喝茶,好像是与沉默有关。可能只是觉得处在一群人的狂欢中却倍感寂寞，一个人独处时却获益良多。所以并不介意沉默、孤独，甚至比喧嚣时舒服。有时候跟认识的人喝茶，漫无边际聊天，看茶叶沉浮，嗅茶香枭染飘起。有时候跟认识的人喝酒，互相调侃，品酒的醇和烈 ​​​ 全文沏一壶好茶，静待陪我喝一辈子茶的人这一生，我不愿辜负的就是这两个，杯中茶给我宁静，心中人使我充实。我们常听到这样一句话：有人的地方就有江湖。其实社会就像是一个大江湖，虽然不是刀光剑影，动不动就血流成河，但也是勾心斗角，处处身不由己。生活给了我们太多无可奈何。但是只有经过这 ​​​ 全文【乌岽古树通天香】花香单枞之一。老枞树，因成茶冲泡时，清高浓郁的香气随风飘逸，满屋皆香故称通天香。通天香属凤凰水仙有性系实生老枞，茶树生长于海拔1000米多的乌岽山上。品质特点：条索紧直，鳝鱼色，油润；内质香气高锐，似自然的花韵香味明显，汤色金黄明亮，滋味甘醇爽口，特耐冲泡。欢迎新 ​​​ 全文香喷喷好茶出炉啦🤗[鲜花][鲜花] oolongtea凤凰乌龙茶人的秒拍视频 ​​​【乌岽老丛蜜香黄栀香】今年春季采摘制作明后正春茶，无性株系，因其香气浓郁，条索紧直，色泽浅黄褐，较油润；内质香气高长，具有浓郁花香味，回甘持久，汤色金黄明亮，滋味甘醇，特耐冲泡。欢迎新老雇主们再次补货备茶 ​​​【凤凰古树夜合香】夜合香单枞之一。老枞树，因内质具有轻微花的香气而名。属凤凰水仙有性系实生老枞，茶树生长于海拔1000多米的茶园里。    品质特点：条索紧结硕长，色乌褐尚润；内质自然花香尚高，花香明显，汤色金黄明亮，耐冲泡。欢迎新老雇主们再次补货备茶 ​​​自家高山古树老茶园「古树蜜兰」树龄200多年的古树老茶树，其外形条索粗壮，香气高扬，回甘力特强，茶干带香，油润有光，并有朱砂红点；冲泡浓香持久，有独特的天然蜜兰香味，滋味浓醇鲜爽，润喉回甘；汤色清澈黄亮，浓香扑鼻，叶腹黄亮，素有“绿叶红镶边”之称。具有独特的山韵品格，欢迎新老雇主们 ​​​ 全文我真羡慕你，爱上茶后.....爱上茶后你会发现你开始嫌弃其他饮品了，茶叶是唯一无添加的绿色天然饮品，它天然、纯净，健康，泡上一杯，热气盈盈绕绕，缠缠绵绵！爱上茶后你会发现你以后春夏秋冬喝什么都觉得不够爽快，总觉得千千万万的饮品当中，没有一个能够像茶一样喝出大地的原汁原味， ​​​ 全文「凤西古树宋种」精焙3次足火，单株采摘单株制作，香气清高，回甘力极强，高山韵味十足，回味无穷，山韵明显，醇厚甘爽，味道与众不同，特耐冲泡，欢迎新老雇主们再次补货备茶 ​​​自家山头的老丛树「乌岽老丛春赤叶」香气十足，浓香扑鼻，茶外形色泽为黄褐油润，显蜜润的质感；其汤色橙黄明亮，香气清高，回甘持久，呈蜜的色感；其香，但细品起来，始觉蜜香浓厚；其味可谓蜜味独到，耐冲耐泡，欢迎新老雇主们再次补货备茶 ​​​"
