Nanade小世界,1,【  九月好事连连 …  】 ​​​
野千禾,1,#周末分享##刘sir提醒#【一首爱国歌曲的家国春秋：清华杰出老校友组团演唱】清华大学上海校友会艺术团在#出彩中国人#上演唱了《我爱你中国》，平均年龄72.3岁的老人唱哭了现场观众。“我们这一代人，有太多太多的过去，大家都是为了祖国的繁荣富强，奉献了自己的一切。有的人在偏远的地方度过了自己的 ​​​ 全文#窦唯将发新歌#近日窦唯在网上发声，讲述了自己的近况：“最近录音及制作的成果甚是喜人”，并且表示自己身上的标签过多，自己也无法拒绝，但自己就是一个音乐人，一个专注做音乐的，专注自己认为真实的音乐的音乐人。关于窦唯：你们都说我是大仙儿，其实我是一个真人。via知书少年 ​​​《大西洋月刊》中文译文 | 洛拉：我家的奴隶她与我们家人一起生活了五十六年。她带大了我和我的兄弟姐妹，从早到晚做饭做清洁，从来没有工资。十一岁的我，一个典型的美国孩子，意识到她其实是我们家的奴隶。中文译文链接>>http://t.cn/Ra1YgWo 英文原文>>http://t.cn/RarD7b3 《大西洋月刊》中文译文 | 洛拉：我家的奴隶 ​​​【风靡Youtube和Facebook的腹肌训练计划】腹肌怎么练？根本上就是这8个动作，明星级华裔健身教练Kelsey Lee专为亚洲女性打造，每个动作20～30次，间隔休息30秒，做几组按自己情况决定。一定要坚持4周，绝大多数人练腹肌失败，就是因为不到4周时间就放弃了。你想要的，只能自己给自己！ ​​​我免费围观了 @丁太升 的回答，问题价值 50.00 元，快来一起免费围观~ 微博问答:丁老师，您觉得大张伟土么？他一直被称为是杀马特，即使在当初玩摇滚的时候也是洗剪吹鼻祖。他一路也是被骂过来的，是否也是因为您说的如同张杰一样的审美缺失呢？ ​​​#周迅哽咽# #见字如面#1949年除夕，一艘名为“太平轮”的客轮遇到海难，船上千余乘客，只40余人获救，被称作中国的“泰坦尼克”。现实没有电影中那些浪漫的细节，但真实的生离死别才榷心飙泪。#见字如面#第二季，今晚请周迅为你讲述这艘沉船的故事。纯享版：周迅读太平轮幸存者家书，读到这句哽咽30秒哭成泪人 ​​​转发桃花大开！【九月#爱情运爆红#的星座】第二名丶天蝎座。九月份天蝎座可以挥别旧爱的阴影，以往你总是迁就着另一半，让对方得寸进尺，但恋情依旧无疾而终。而进入九月，天蝎能遇见和自己性格相仿的对象，彼此惺惺相惜，他总是能了解你的内心想法，建议你多往电子卖场或百货走走看看，遇到不懂的就問 ​​​ 全文【你见过的最叹为观止的营销是什么】少点套路，多点真诚...... ​[笑cry] ​​​国际关系学院副教授储殷的演讲《舌头与牙齿的智慧》，告诉你我们的底气从何而来：我们在改变国家，国家也在改变我们，国家强大之后，我们变得自信了。真正的大国心态应该是胸怀天下，心存仁义。值得一看↓↓ 人民日报的秒拍视频 ​​​【最热门的平板变式，每天一分钟全身瘦】平板支撑（PLANK）可以有效锻炼腹横肌，被公认为训练腹肌最有效的方法之一，每个动作坚持做到最少30秒到1分钟即可，每天坚持做可以让平坦的小腹重见天日。有些动作比较难，可以慢慢适应做几下就可 ​ ​​​​
Bubblyme,2,#文怡菜谱#：10分钟就能做好的——【蒜煮醋鱼】：1）收拾干净的小平鱼，洗净撒盐，腌3分钟。  2）锅内倒油，油热后放蒜瓣，炒到蒜瓣焦黄，放入豆豉炒香。  3）放入鱼，加没过鱼一半的水，糖，醋，黑胡椒碎，大火煮开后，转小火煮7，8分钟就行了。 ​​​#健康/减脂食材List# 一个囊括了我自己减脂期食用的所有食材的List，不仅仅是减脂期，平时我90%的食材也基本源于此（只是饭量是图中的减脂期饮食的翻倍哈哈）You are what you eat! 如果你不知道怎么吃，就照着List开吃吧[嘻嘻]食材烹饪上遵循少油少盐，就是标准的减脂期饮食～ ​​​“孤独的房子”，来自葡萄牙摄影师Manuel Pita。你最喜欢哪一个？ ​​​德国插画大师Quint Buchholz布赫兹插画作品二 @阮筠庭 @LISK的围脖 ​​​妈呀！为什么才让我看到！在东京，我一天吃七顿 ​​​『冯唐的公开信｜用兽性、人性和神性来对抗信息时代』冯唐的公开信｜用兽性、人性和神性来对抗信息时代 ​​​#君の名は。##你的名字##圣地巡礼#为方便巡礼自制了东京部分的地图，地点较全，全部附带截图，有些增加了实景照片，地图地址见评论。 ​​​鸡蛋抱豆腐...可以说是非常好吃又易做了！[心] ​​​虽然在杜布罗夫尼克--我心中的欧洲横店里没有坐上铁王座，但是站在君临城外的山顶仿佛来到世界尽头。「Valar Morghulis」凡人皆有一死，嘛…那就及时行乐咯！Main Title-Ramin Djawadi ​​​一直在ins关注一个意大利手绘大神Liam Hipple画佛罗伦萨的Duomo广场的过程…最近以为快画好了，已准备好献上膝盖，没想到这几天又开始上色了，原来还是彩色的！[色][色][色]@DavidWayne @Astrok @透明胶卷卷 @贝壳苏臻 @外號無敵波 @都灵的安东尼啥都不灵 @Ben吴滨 @shanghailander @马良 ​​​
行走的面条02,2,"哪些习惯慢慢地可以改变一个人的生活？ ​​​​你要学会的不仅仅是Ctrl+C 和Ctrl+V！！！ ​ ​​​【实用瘦腿运动】满满的干货！9个动作超级燃烧腿部脂肪，超级累但超级有效，一定要坚持哦~椒妹儿先练起来啦[doge]#我心中未来五年的成都# ​​​平面设计排版、书面设计排版  、模板样式基础参考 ​​​​。 ​​​【司机吃月饼过敏抽搐，警车护送紧急就医】10月1日凌晨，江苏南通，沈海高速上一驾驶人因误食月饼过敏抽搐，同车女子应急道上向交警挥手求救。交警开警车护送车辆，并联系120等候，因抢救及时男子已转危为安。澎湃新闻的秒拍视频 司机吃月饼过敏抽搐，警车护送紧急就医 ​​​去水印的三种方法,技能get！自己借鉴，转需~全球顶尖摄影的秒拍视频 ​​​【在家就能做的瘦手臂操】#生活服务#准备2个哑铃或装满的矿泉水瓶。9个动作，每周3次，30天告别拜拜肉！据@人民网 ​​​世界也许只想你变笨！20个学校里不会教你的人生道理（出处见LOGO) ​​​【世界上最健康的作息表】晚上睡不好，白天没精神？看看最健康的作息表吧↓↓↓ 健康需要长期坚持哦，转而收藏之！ ​​​​【适合新手的快速减手臂运动】跟着这套动作从头跳到尾！秀场手臂跳出来！时长13分钟，节奏感十足哦#减手臂#秒拍视频 ​ ​​​"
五加一666,2,给自己规定，以后再写超过两千字，就不允许发公号了，哪来那么多表达欲，都给我憋住，憋不住，就精简[并不简单] ​​​朋友看完 天才抢手，来跟我讨论男主班克。谈到班克父亲缺位，母亲只知道抱怨这样的家庭环境对他性格的影响。太让人丧气了。丧气到想哭。一开始的他，正直到可笑，看到同学作弊，气得锤桌子，嫉恶如仇，直接向校长告发。心理承受力极差，压力一大就会呕吐。没有朋友，被富二代找人揍了扔到垃圾堆，绝 ​​​ 全文看到陈冠希在ins 晒娃，曾经这么桀骜不驯的少年啊，有一天也会变成父亲。 ​​​即将入冬的时候，人总是脆弱而又疲倦的。强行打起精神，思考着下一句话该说什么才能扳回一局，不料对方却突然松了口。觉得自己很像拿着刀准备赴死的主人公，杀进敌军腹地却发现对方已经缴械投降。 ​​​​你相信天长地久吗？我相信，为我很喜欢的公号写了2000字软文。 ​​​读到一个今年3月的研究说，其实遭遇过心理问题的人是多数，一直保持心理健康的人才是少数。在11岁到38岁这段时间里，只有17%的人始终没有抑郁、焦虑或者其他失调，剩下83%的人都遇到过心理问题，其中一半的人是反复的或者持续几年以上的……真是令人安心的研究_(:з」∠)_ ​​​已经好久没吃711的关东煮了。最近买得最多的是500ml 那种鲜牛奶，从冷藏柜里拿出来，还很冰。小口小口的含在嘴里，含5秒，齿间有奶香，等它跟体温一样，再狠狠咽下去。地铁西二旗到霍营，二十分钟，喝一盒刚刚好。 ​​​近乎变态的喜欢着最近的气温，不像夏天，需要刻意把空调调很低。把身体缩一团，本能的裹紧被子，温度就刚好。最近周末醒来，还可以心安理得的眯着眼窝在被窝里玩，或者睡回笼觉。天暖和就不能这样，会为偷懒感到抱歉的。天太冷也不能这样，加被子还冷，何况还有让人抑郁的雾霾，很容易就陷入俗气的冬 ​​​ 全文我们 ZeeTea 招一个城市增长专家，growth hacker。这个部门是一个比较特别的部门，是一个其它餐饮公司完全没有的部门。我们不要你有经验。我们要的你是——合理合法、不折手段。Be relentlessly resourceful! ​​​《天才抢手》的结尾真让人难受。看到男女主去悉尼考试那段，紧张得心冒到嗓子眼，那一刻真希望他们能舞弊成功。没法去顾虑，这些答案的外流，对没钱购买的普通学生也一样不公平。只希望这两个普通又不普通的年轻人能通过这样的冒险付出变得跟身边那些同学一样，是的，不需要超越，只要一样就好。可结尾 ​​​ 全文
倪呀么小乐,2,我免费围观了 @郑力行 的回答，问题价值 42.00 元，快来一起免费围观~ 微博问答:郑工你好。您之前提到过底妆问题，想请问粉底液，粉霜，粉饼，粉条的配方区别？还有它们的受众面？比如痘皮用哪些更安全，干皮油皮更适合哪些？我喜欢一个台湾博主，也是学 ​​​最近又一款市内送货机器人上路实测了。它叫YAPE，来自意大利的一家机器人公司，最大特点是采用类似平衡车的两轮结构[笑而不语]。#机器人# #送货机器人专辑# 小龟是个机器人的秒拍视频 ​​​#物种日历# 别以为河狸只会卖萌，它们还是经验丰富的水利工程师！顾家的河狸会在小沙洲或湿地上用树枝、泥土、落叶、石块等修建起巢穴，和同伴一起筑起河狸坝，将巢穴入口隐藏在水面以下。为了筑坝，河狸们点满了啃树技能，然而，河狸会不会被自己啃倒的树砸死？答案是……会！http://t.cn/ROkNE5V ​​​trump到处有机会就吹嘘自己的IQ很高。他大学读书时候的教授都忍不住了。教授William T. Kelle说：trump是我教过的最Goddam蠢的学生”。http://t.cn/ROdwwao ​​​心疼爸爸，澳洲华裔老爸和他的傻儿子，儿子专注#坑爹#一百年！笑声有毒[笑cry]Happy张江的秒拍视频 ​​​当代著名音乐喷泉指挥家，哈哈哈哈哈哈哈哈下腰劈叉不在话下[允悲] 最基腐的秒拍视频 ​​​有些男性成为父亲后会很温柔，真是难以名状。像契诃夫小说结尾处常有的那种调子，生活展开了，一些崭新的东西出现了。本期正午是“@刻画视频 ”出品人、作家@苗炜 的故事。 他的个人问题 | 正午 ​​​没养过婴儿的人可能会以为，婴儿哭的话，就坐在沙发上搂着ta，拍拍摸摸安抚一下就好了。呵呵呵呵……并。不。是。[允悲]不但要抱，而且要站着抱，不但要站着抱，而且要不断走动…… 简直好像身边多了个只要看你不运动、就“哇”的一声哭出来的健身教练……（所以说，养娃前请多多举铁+锻炼核心肌 ​​​ 全文看到Harvard Gazette对今年MacArthur Fellow南亚研究教授Sunil Amrith的报道，在获奖之外，全文报道并行的重点是他这个月刚刚有了一个女儿。文章里写，“女儿才一周大，所以他早上醒着毫不奇怪”——突然觉得好萌啊。另外岔开说一句，石黑一雄得了诺奖后，Vox有一篇报道写他的创作模式是持续数天的诸 ​​​ 全文【85岁阿婆摆摊，路边卖五香蛋为孙子赚学费】李秀芳卖五香蛋近40年，每天推着三轮车去路边摆摊。老伴的配料，长时间的熬煮，让五香蛋特别入味，广受追捧。她说：“我赚的钱不舍得花，供孙子念书。我没有什么梦想，只想把生意做好，让孙子过得不比别人差。”二更隐藏菜单的秒拍视频 ​​​@二更更南京 ​​​
丧丧day,6,​• Drama •强烈安利最近好评满满的tvn月火剧#今生是第一次#！女主郑素敏饰演一位苦不得志、母胎单身的女作家男主李民基饰演一位房贷奴隶、直男但内心温暖的程序员讲述着两人从房客关系变为契约结婚再到慢慢喜欢上对方的浪漫故事是一部让你上一秒笑到窒息下一秒又立刻泪目的现实爱情剧演技和 ​​​ 全文说真的，我现在越来越强烈的感觉不会碰到和我兴趣爱好各种观念想法都和，生活在一起不会有压力，可以吃到一起去玩儿到一起去，也不嫌弃我一堆坏毛病怪性格的人了。我不爱说话喜欢一个人呆着，可是一个人呆着怎么去认识别人呢？说是喜欢温柔有趣的人，这样的人会喜欢和他同样优秀的人啊， ​而且我生活 ​​​ 全文蜜月旅行回來很重要的一個心得就是：@林宥嘉YogaLin 真的把他畢生的努力與天賦都奉獻給音樂了⋯ #傳說中的老公視角#[攤手] ​​​【八组热议】袁泉的这组照片，真的是高级美啊，这个气质，服了[跪了] ​​​如果有一天我了无音讯，那我一定在某个角落在好好生活 ​​​【越南自由行攻略】毕业后独自在越南自由行十天，便宜又好玩[太开心]，能够体验多国文化的碰撞交融。这篇既是攻略也是越南游记，欢迎去玩过的孩子们补充完善[爱你]P1｜准备篇P2｜胡志明攻略P3｜芽庄攻略P4｜会安攻略P5｜岘港P6｜购物攻略（护肤品推荐原贴 http://t.cn/RM5ocTY） ​​​ps.图长 ​​​ 全文#盖房的护肤# 西班牙品牌 Singuladerm 四款产品功课P1 说在前面&[礼物]卷花氟氯[礼物] P3 Xpert S.O.S 安瓶精华P5 Xpert Sublime 抗衰老面部精华P7 Xpert Contour 消肿紧致眼胶P9 Xpert Collageneur 紧肤面霜总的来说Singuladerm的产品是很少见的全肤质可用，适合有初期抗老需求和希望改善已有肌肤 ​​​ 全文『镇三关重庆老火锅』📍工人体育场北路工人体育场北门在工体偶然发现的 刚好又想吃辣火锅了 就试了试 没想到味道还真不错[小黄人高兴]天冷吃火锅真是太开心了！(๑✦ˑ̫✦)✧*[粥]鸳鸯浓香猪骨锅底◎ 牛蛙/精品千层肚/鲜牛肉/香菜牛肉丸/雪花肥牛/藕片/红糖糍粑/唯怡豆奶锅底很香，辣味也足 ​​​ 全文为什么突然这么多人问我头发的问题，谁会给两岁的孩子烫头发呀……[允悲][允悲]晚安辣朋友们 ​​​
_____Christine_____,4,"有哪些食物常吃有利于女性健康？ ​​​​[赞]收了~！ ​ ​​​人有悲欢离合 月有阴晴圆缺 此事古难全 ​​​#62岁最牛运动男神#【62岁不服输，你大爷还是你大爷！[威武]】在四川，有3位帅炸了的62岁大爷：逆龄硬汉徐智林，坚持健身19年，练出超炫腹肌，被称为""大爷中的彭于晏""；街头单杠牛人李剑云，可以在单杠上连甩360度大回环。他说，运动的初衷是为了远离麻将，培养健康的生活方式，人称""杠上飞""；花游男神 ​​​ 全文一美国女子打911报警电话，警察接通后她说想要订披萨。这是一个根据真实事件语音还原的短片，看到最后不禁让人捏把冷汗。。[衰]最神奇的视频的秒拍视频 ​​​【排骨山药玉米汤的做法】一道味道清甜、营养丰富的美味汤水，快收了做给心爱的人吃吧~ ​​​​ 小食刻的秒拍视频 ​​​​金桔这么一煮，润肺止咳，常年不咳嗽… ​​​#太阳猫早餐# 越吃越瘦的藜麦饭团，超适合长假吃月饼吃撑了的你[挤眼]有小盆友不知道藜麦，其实藜麦是一种很健康的的食物呢，健身的小盆友一定不陌生，它的低GI值可以带来持久的饱腹感，消化的缓慢也避免了血糖过快升高造成的脂肪堆积，而且拥有9种人体必需的氨基酸，作为植物，可以说是非常良心了！ ​​​ 全文九个生活小窍门，让你的生活焕然一新.马住学起来[來][來][來][來] ​​​苹果官方 iOS 11 UI设计素材   San Francisco Pro字体！ 苹果官方 iOS 11 UI设计素材 + San Francisco Pro字体 ​​​补发：菠萝咕噜肉教程，请大家参考！ 陕西老乔吃货的秒拍视频 ​​​"
MEWLEiL,3,我在这里再分享一次我三月份就写的也是唯一的一篇关于饮食的文章！最近有不少人在质疑甚至造谣我分享的碳水循环饮食方法，比如什么一晚上吃900克碳水，一顿吃900克碳水，还有什么9斤米饭。希望你们不要继续误导别人，也建议你们认认真真把这篇文章看完再下定论。文章中我也提到这是我个人备赛的饮食方 ​​​ 全文难道我(的责任)就该让他每天都这样累吗？衣服舍不得买，吃吃不好，睡睡不好，每天半夜还要出去工作，最近生病还要照常奔跑！孩儿不孝，还时常让您生气，明知道您只是想劝说我先好好上班，手头事情还没有明确下来，但我不想有负面，说些让您伤心的话！在等几天无论那边结果如何我都会加倍奔跑！……【背 ​​​ 全文我免费围观了 @餐饮首轮投资 的回答，问题价值 20.00 元，快来一起免费围观~ 微博问答:餐饮品牌淘汰越来越快，有的品牌可能第一年很火，过两年就被大家遗忘，竞争如此激烈的当下，作为一家新的餐饮创业公司，该如何留住人才，找到合适的市场定位？在主流都去做 ​​​我免费围观了 @餐饮首轮投资 的回答，问题价值 20.00 元，快来一起免费围观~ 微博问答:您好，想问一下，快餐行业，如何应对同行的抄袭？ ​​​转换不同角色，翻转出不同味道的人生。羡慕这些人的精彩，不如开启自己的路。因为奔驰SUV知道，每一辆SUV都会藏着一段征途！即刻报名“2017梅赛德斯－奔驰SUV征服之旅”，征服天地，颠覆自己！天地即征途！ ​​​你们怎么看？欢迎大家说说自己的想法！ ​​​坚持是成功者的电机！影片讲述奶昔搅拌机推销员雷·克洛克在上世纪50年代遇到了经营汉堡快餐的麦当劳兄弟后嗅到商机；1961年，他用270万美元买下了麦当劳兄弟的汉堡连锁，将其打造成了全球最大的快餐王国。 ​​​网红店有两种：名副其实和名不副实。你是什么样就会关注什么。名副其实者会看对方内功。名不副实者会看对方营销。 ​​​明白很多道理却仍然过不好这一生，是因为虽然明白、但没有行动，所以一切不曾改变。 ​​​【首富王健林励志演讲:《再坚持一会儿》】如果你们想成功 ，就先要学会多吃苦。做任何事情，如果没有一种咬牙的精神，是不可能成功的。年轻人一定要学会吃苦啊！相信看完后，你一定会有所收获。时间较长，建议大家先转后听！http://t.cn/RyU1xs6 ​​​
这屋主人今自居,5,在冬天的室内假装晒太阳[兔子] ​​​哭到一半被人打扰了 ​​​匿名互助小组就是人类之光啊。 ​​​父母总是把孩子当工具培养，却又不把他们抓紧，以至于让他们意识到了这一点。 ​​​你的特别，恰恰是你的问题 ​​​一直以为共享猫咪只是一句玩笑话[摊手][摊手][摊手]真心希望这个行业千万不要发展起来，否则又将有不计其数的猫咪进入牢笼甚至 活的还不如猫咖里的店猫。 ​​​今天被慰问了一，二，三，四波，看来对别人的关心也是会传染的。 ​​​“文学想象的核心错误，就是这样的观念：别人都像我们并且必定像我们一样感受。事实上，人际之间尊重的缺乏，还有冷漠，使他们互相残杀而无须内疚，无须对残杀有所思考。这一切都源于这样一件事实，人们从来没有关注过这样一个明明白白的深奥道理：其他人也有灵魂。” ​​​2017了，小行星不愿临幸地球。小行星大概很忙 ​​​我已经厌倦了争吵 ​​​
天空的颜色852,5,请不要怀疑我，我就是何思云。 ​​​花很美.人很暖.谢谢你们一直都在[握手] ​​​我们🐢群来看你们了！ ​​​有网友发照片过来，今天在汽车火灾现场看到舅舅@朱庆丰57265 的身影了，依旧很热心，只是背影很让人心疼，好在最后没有人员伤亡。 ​​​今天去的杭州第一社会福利院，全院有近五百号人，包括八十多位的工作人员。大多数是精神智障人员。很多很多是很小的时候待在孤儿院，长大了以后转到了这里。他们或许平时看不到什么生面孔，今天见到了我们，每个都很热情很开心。他们的笑容灿烂，越灿烂我越感酸楚。他们的智商完全低于正常水平，正因 ​​​ 全文今天下午去了杭州第一福利院看望了老人和残疾孤儿，做了些力所能及莫事并送了些衣物和水果，生斌还给老人理了发！而一路上让我思考的最多的是………多么好……无忧无虑活着多温暖……有好心人呵护多心寒……那么无助孤独让我更感动的是福利院的工作人员，她们长期在哪里，拥有比常人更多的爱心和 ​​​ 全文今天去的杭州第一社会福利院，全院有近五百号人，包括八十多位的工作人员。大多数是精神智障人员。很多很多是很小的时候待在孤儿院，长大了以后转到了这里。他们或许平时看不到什么生面孔，今天见到了我们，每个都很热情很开心。他们的笑容灿烂，越灿烂我越感酸楚。他们的智商完全低于正常水平，正因 ​​​ 全文今天去的杭州第一社会福利院，全院有近五百号人，包括八十多位的工作人员。大多数是精神智障人员。很多很多是很小的时候待在孤儿院，长大了以后转到了这里。他们或许平时看不到什么生面孔，今天见到了我们，每个都很热情很开心。他们的笑容灿烂，越灿烂我越感酸楚。他们的智商完全低于正常水平，正因 ​​​ 全文今天去的杭州第一社会福利院，全院有近五百号人，包括八十多位的工作人员。大多数是精神智障人员。很多很多是很小的时候待在孤儿院，长大了以后转到了这里。他们或许平时看不到什么生面孔，今天见到了我们，每个都很热情很开心。他们的笑容灿烂，越灿烂我越感酸楚。他们的智商完全低于正常水平，正因 ​​​ 全文下午我会去杭州市第一福利院做做义工，在屋子里憋得太久了，也当是透透气吧。像朋友劝导时说的，做一些对社会有利的事情，帮助别人获得满足。也许真的可以分散一下注意力，让痛苦升华。 天气越来越冷，我会捐出六百件衣服，希望可以给他们送去温暖。我还打算给他们理理发，这也是我力所能及的事情。 ​​​ 全文
