Nanade小世界,1,【  九月好事连连 …  】 ​​​
Nanade小世界,2,#微博8周年#2009年8月28日，微博开放公测。今天，我注册微博2393天了，你呢？ 微博8周年 ​​​写给女儿：我宁愿你不“善良” ​​​有时候，我多么希望能有一双睿智的眼睛能够看穿我，能够明白了解我的一切，包括所有的斑斓和荒芜。那双眼眸能够穿透我的最为本质的灵魂，直抵我心灵深处那个真实的自己，她的话语能解决我所有的迷惑，或是对我的所作所为能有一针见血的评价。                       ——三毛《雨季不再来》 ​​​#微博财报# 【微博市值突破200亿美元 创历史新高】继本周一大涨9.51%后，微博（NASDAQ:WB）今日盘前股价再度上涨，市值首次突破200亿美元大关，创历史新高。微博市值突破200亿美元 ​​​#做女王最爱的diao#随手一抽，红包到手！我刚刚抽到了雕牌雕兄说 的现金红包！这只是个开始，据说还有高达200元的大红包呢！ 不说了，我继续抽红包去了！雕牌雕兄说 的红包 ​​​
用户6105981485,7,加强煅炼，提高夲人身体质量 大同·兴乐中学 ​​​我在这里 大同·兴乐中学 ​​​我在这里 大同 ​​​我在这里 大同·兴乐中学 ​​​你真的会跑步吗？[喵喵]如何防止跑步受伤，专业健身教练告诉你如何正确的跑步[耶]坚持跑步锻炼可以越跑越年轻、越跑越美丽，达到逆龄的效果。[心] 瘦身教主Alice的微博视频 ​​​#寻味大同# 大同·武灵镇 ​​​用户6105981485 打卡第18天。运动不为了证明什么，我只是在做自己，#不屑风雪#。一起来打卡社区 蜕变吧！ ​​​用户6105981485 打卡第17天。运动不为了证明什么，我只是在做自己，#不屑风雪#。一起来打卡社区 蜕变吧！ ​​​用户6105981485 打卡第17天。运动不为了证明什么，我只是在做自己，#不屑风雪#。一起来打卡社区 蜕变吧！ ​​​用户6105981485 #运动不放假# 打卡第16天。运动不为了证明什么，我只是在做自己。一起来打卡社区 蜕变吧！ ​​​
深西-,4,未知，讨厌一切未知，让我回到三个月前，回到遇到你之前。Whiskey (分享自@虾米音乐) ​​​好想死 ​​​我对不起贵行，我是辣鸡[泪] ​​​为屁恩真是登上就不想等下来，因为怕下次再登就登不上了 ​​​莉已经上升到和我镜头相机一样的地位了，说出血就出血[拜拜] ​​​想看欧容。 ​​​虽然我不喜欢高更，但是他有段话说的真好。 ​​​一个月总是能听到几首要死在这首歌里的时候 。分享  Lostboycrow 的歌曲《Stay a Little Longer》Stay a Little Longer (分享自@虾米音乐) ​​​很烦，决定去混迹社会，该谁谁，不用束缚我，你也束缚不了我，希望有人能认识到我已经不再是little young lady了 ​​​
用户6100050305,1,【你无法管理时间，你只能管理你自己】每天都忙得筋疲力尽，总觉得时间不够？很多时候，你很累，是时间管理出了问题。缺乏计划，做事没头绪；同时安排很多事，消耗注意力；做事拖延，不能马上开始…时间是公平的，你无法阻止时间的流逝，你只能管理你自己。18条时间管理建议↓↓从今天开始改变，早安！ ​​​
MJ匠品奢侈品置换,1,"吴丽玮要写网红，她这几天把top10网红的供货商什么的跑了跑，就知道了哪网红的衣服最注重品质，面料和做工好，用的是大牌的生产线。我俩就在出租车里翻店里的衣服，可一件都不想买。吴丽玮说，因为我们都不缺这一件衣服呀，好像各类型也都有。而且，像大衣这种占地方的单品，我们不会买几百块钱一件的 ​​​ 全文袁泉 在上海荣宅拍的一组片子，黑白画映,气质绝佳。 ​​​#Hermann微评# 【大陆电商 vs. 香港实体零售——世界最能回应消费者需求的渠道？！】日前我陪同澳洲现代购物中心主导大师#Mr_Michael_Lloyd# 考察香港老牌购物中心的改造升级时，我问他觉得香港的零售怎么样？他回答说：“很棒，香港零售是世界一流的，非常能回应消费者的需求。”这里说的零售当然是指 ​​​ 全文#转发抽奖# 赢上海时装周2018SS人气设计师CJ.YAO 秀场门票 想要参与上海时装周？想走进人气设计师的秀场？ #康泰纳仕时尚设计培训中心# 粉丝福利时间到！ 参与抽奖活动即可有机会赢取上海时装周珍贵入场机会观看人气设计师秀场 转发赢上海时装周人气设计师CJ.YAO秀场门票 ​​​#微博橱窗#【2017.10.09号】 NEW UPDATE            上新时间订在10月9日晚上20:00 预览会提前出 。喜欢哪个look告诉我。转发+点赞抽2名送其中任意一件单品。 ​​​ Abow Studios 2017 F/ ​​​#LOEWE罗意威2018春夏# 的秀场后台也蕴藏许多细节：全新推出的Gate手袋与Tent手袋在闪光灯下呈现迷人色泽，每件衣装的质地纹路也都清晰可见。全新加入动物系列大家庭的小兔手袋也可爱得让人无法拒绝。 ​​​【2017.8.31号】 NEW UPDATE            毛衣做了三色颜色纠结吗？喜欢什么颜色呢？[来]点赞和转发 告诉我会随机抽一个送一位神秘礼物哦 ​​​在来自时装编辑Sherry @泶哩 的LOEWE罗意威Barcelona心爱手袋搭配中，大面积的黑色被用来凸显红色的爱心图案，让这份特别心意显得尤为精致可爱。 #ILOEWEYOU# ​​​​爱马仕1P鸭子蓝22厘米菜篮子售出[飞机]️ ​​​罗子君当柜姐的名牌店，凭什么一双鞋子就快一万？ ​​​"
一只小绿有深度,1,【沙画故事：我走遍了世界 今天也要回到您身边】在你成长的路上，是否也有这么一位老师，让你至今记忆犹新？今天，教师节，为老师转发！致敬！[心]你还记得你的老师吗？@央视新闻 央视新闻的秒拍视频 ​ ​​​
虎牙激萌,2,分享图片 ​​​gordon死前走马灯这段真的拍得好棒，灯光效果加成，令人心碎[傷心]是说，此集所有灯效成本大概基本都花在这一段了吧 ​​​#生而由我，瓶熠心声#TA天生不凡，随心创作属于自己的旋律；TA特立独行，从不妥协盲从他人声音。TA是最独特的存在，也是SK-II护肤精华露全新形象代言人。TA是谁？转评此微博说出你的答案，即有机会获得SK-II改写命运宣言限量版神仙水一瓶。答案，明日揭晓。 ​​​看这眼珠子 ​​​我承认，我焦虑，停不下来刷微博或者总想做点自以为有意义的事比如清理微博收藏、清理电脑C盘D盘，我觉得我应该丢掉一些虚拟、没有实体的东西；我拖延，不肯正视下个星期要考试的复习资料…我在浪费时间，两年了，我在杀死我自己…我想去旅游，就找个地方发呆，但是我下个星期要考试… ​​​[吃瓜] ​​​又做了个奇怪的梦，梦见考电脑不及格（[費解]）补考，结果被搭讪，考完试后看手机微信居然被加了群组（[費解][費解]），出了学校，误入住宅区，迷路了，走不出来，醒了。 ​​​中条彩未在巴黎参加Chanel的派对，英日混血的她还是有些别样的美！ ​​​スイスの高級腕時計ブランドと町家が融合。.｢ウブロブティック京都｣が祇園に登場｜きょうとあす by 婦人画報http://t.cn/ROq2gsD ​​​似乎体质变差了，来m前兆是皮肤起颗粒？[費解] ​​​
小缦c,2,【福利】real嘻哈的成都小伙伴们，距离本周六“ONO MUSIC GROUP 独壹不贰CHINA Tour 2017全国巡演成都站”还有不到三天！票子都准备好了吗？还没有的朋友一定要看过来！关注并转发此微博，就有机会获得门票免费去现场听@ONO独壹不贰Official 全员出动现场嗨唱#全部都是你#、#再也没有#等大热歌曲哟！明 ​​​ 全文[星光]成都9家咖啡•甜品•brunch好去处[星光]这9家都算是比较新的店～以后不定期给大家整理新店还有喜欢的店 好不好[太开心]嘿嘿 祝大家都中秋节快乐[心] ​​​#轻松一刻#【嗷！二哈第一次打针抽血，嚎得那叫一个...[二哈]】嗷嗷嗷嗷嗷嗷！最后整只汪近乎失声，失去梦想的狗子，满脸都写着绝望...@梨视频 全球视频大魔王的秒拍视频 ​​​#浅仁星象#【白羊座满月】：今天凌晨两点多，我们已经正式迎来白羊座满月。无论你是什么星座，也许都应该重视这次满月的影响。白羊座满月同时对冲水星，且四分冥王星。这意味着，除了白羊座本身所具备的爆炸性的强大能量，我们可能还会面临一些严峻而激烈的纷争和颠覆。 浅仁星象 | 白羊座满月来临，一些感情债，到了最终清算的时期 ​​​#浅仁塔罗10月运势# 【白羊座】：本月你的情感充沛，直觉力强，较为注重自己的内心感受，似乎易处于多愁善感的状态。这段时间你似乎颇为感性和理想化，也乐于为生活情趣而付出自己的精力。事实上，这个月对于白羊座来说极为重要，注定会让你经历一些大的转折与蜕变。尤其是在自我认知、生活定位、情 ​​​ 全文宴请贵宾被我的厨艺折服kkkkkkk ​​​#石原里美# 在写真集里分享了自己在《失恋巧克力职人》《亲密姐妹》《朝五晚九》《校对女孩河野悦子》的妆容技巧，每个妆容都是完全不同的风格[并不简单]而且从造型到妆容到指甲，都是十元亲手包办哒[憧憬]要做仿妆的小姐姐们可以马住这份超强攻略啦[小黄人高兴] ​​​分享图片 ​​​#雷哥GMAT逻辑刷题团打卡# D5 @雷哥GMAT在线 🐼 ​​​#雷哥GMAT逻辑刷题团打卡# D3打卡想死的心都有了@雷哥GMAT在线 ​​​
迷你summe-r,1,哈喽[太开心]这里是各行各业的福利社[广告][广告][心]你缺客‣源？缺人‣脉？没生‣意？[心]我这有史上最强的引‣流客源方法[心]为您解决一切客‣源问题[心]为您锁定更精‣准人群[心]一次正确的选择  大于百倍的努力[心]加了我  你就成功了一半！ ​​​♡想要改变的，来撩我 ，我宠你 ​​ ​​​宁波也是一秒入秋，又到了穿软绵绵的毛衣的季节了，iPhone 8 十连裂，吓得我都不敢换了[摊手] ​​​成功=心态×方法×行动力①心态：心态决定命运。②方法：一个成功的人一定善于总结方法。③行动力：成功的结果最终取决于行动力的高低，行动力将使等式的左边产生奇妙而强大的倍数效应。④精彩的人生不是想出来的，而是行动缔造出来的。从这个意义上说，行动比思想更重要。 ​ ​​​♡越来越多的宝贝受益于我家軟[微风]件♡出了6单，不多，但是回本了♡越用越上手，今天入了2000[亲亲]♡很多时候，没有人可以左右你的人生，♡只是很多时候我们需要多一些勇气，去坚定自己的选择。                                           ✔ ​​​[微风]客[微风]户[微风]反[微风]馈[微风]一个又一个的软·件受益者，好东西不光我在用，越来越多的微‣商已经加入我们，看看这位美女怎么说的把你所有的不幸总结成一句话，然后问问自己：＂3年后，你还想过这样的日子吗？” 相信问题就会迎刃而解。所以趁年轻抓住机会好好努力。 ​​​越哥送我手表好喜欢忍不住多拍了几张[害羞][害羞]                                                [tm] ​​​祝你生日快乐 ​​​[微风][微风][微风]天塌下来，有个高的人帮你扛着，可是你能保证，天塌下来的时候，个儿高的人没在弯腰吗？之后，还不是得靠自己！♡靠人不如靠己，老话说的一点没错，我们女孩子一定要有挣钱养活自己的能力♡ ​​​[微风][微风][微风]想要一个东西就去买，喜欢一个人就去追，哪怕最后那个东西没有用，那个人没有跟你在一起，都没有关系。人生苦短，要知道遗憾要比失败可怕的多。​关于挣[心]钱，小美女总结得很到位哦[羞嗒嗒] ​​​[太阳]️[太阳]️[太阳]️多读书、多健身，然后变得温柔、大度，继续善良，保持可爱[白羊座]︎ ​​​
阿拉蕾变身咪,2,遇到巨婴男与那些负能量的关系，该怎么办？自然是分开。只是，道理都懂，真正脱离开，那并不容易。婚姻中那条“宽容”与“委屈”之间不可言说的界限，到底在哪里？到底是否有一个清晰的讯号，告诉我们“分吧，他不是对的人”，或是“留吧，我们应学会多体谅”？希望从这个故事中，你能得到答案。  ​​​ 全文【屋顶告白大会！他的深情告白让全校女生尖叫，结果...[doge]】日本八街南中举行了一年一度的“屋顶告白大会”。由校长主持，鼓励学生们向喜欢的人大声表白。一位初二正太走上屋顶，深情表白同桌的女生：“我的旁边坐着一个天使！”全校女生都尖叫不已，他到底能不能成功呢？[笑而不语]@全球视频大魔王 ​​​ 全文哈哈哈哈哈哈哈哈哈哈哈哈哈哈哈哈哈哈哈哈哈哈哈哈哈哈哈哈哈哈哈哈哈哈哈哈哈哈哈哈哈哈哈哈哈哈哈笑死！！！ ​​​无论是职场，生活，还是朋友之间的交往，喜欢劝女孩子喝酒，陪酒的，都是坏到骨子里的人。今天早上的时候，有个姑娘给我说了这么一个事儿。她工作两年，最近刚跳槽换了工作，到了新公司，收入比以前是提高了，但很郁闷，原因是上周他们公司出去团建旅游，晚上吃饭的时候，部门二把手说对她说：「等下 ​​​ 全文油条要刚炸出锅，松松脆脆金黄色！面香气！然后咬断，丢粥里。吸溜！嚼！豆腐花也是可以配油条的！当你在半夜饱含着对食物的激情啪嗒死掉了，听到油条两个字就能醒来。站不起来就坐着，原地张嘴听我讲：脆脆的——最脆的部分像煎饼果子里的脆皮，柔韧的部分还有面香，金在外，白在其中。啊，油条。 ​​​真实还原爱豆#演唱会#现场，疯狂的粉丝们到底做了什么？哈哈哈哈王俊凯的化学老师你还好吗。。。差点儿就信了[笑cry](邓先森)Happy张江的秒拍视频 ​​​该微博因被多人举报，根据《微博社区管理规定》，已被删除。查看帮助：http://t.cn/Rfd14WYB站回应，电视剧专栏全部被下架之后，未来互联网的正确打开方式是这样的[doge][doge][doge] http://t.cn/RKo409m ​ ​​​发布了头条文章：《王者荣耀和被禁止的童年》 ——我也不是说，年轻人花大量的时间和金钱去玩游戏就是对的，但问题的根儿，确实不是在这里。“该结婚的时候结婚，该生孩子的时候生孩子”，人们总是在讲到什么年龄干什么事，那是不是也应该包括，该玩的时候玩，就让孩子玩呢？ 王者荣耀和被禁止的童年 ​​​转眼快60天了，尹玲华阿姨马上就要离开我们，心里有万分不舍。产后出现的各种问题远超出预期，阿姨耐心的帮我解答，开导，让我保持情绪稳定。宝宝一开始吐羊水，阿姨整夜整夜不睡的看着。长到现在白白胖胖，阿姨功不可没。祝愿阿姨以后工作顺利，身体健康。@爱的果实孕妈联盟 ​​​
haischu,1,不卖人参果的超市可以倒闭了谢谢 ​​​只要歌好，唱歌的人怎么样不重要，真是不对的，真正好的音乐是只有长得好看，心地又善良的人才能做的出来的。也就是说，有的歌一听，你就觉得这乐队应该是长得特好看，人特别善，特别真诚，一看照片，果然，一看twitter/微博上的言论，果然。 ​​​awww好喜欢[飞吻]💕年轻就是好啊 ​​​【王俊凯爆炸盒子】豪华精装版[小黄人高兴]#爆炸盒子##手工DIY# 荏苒BE_HAPPY的秒拍视频 ​​​我得了一种一去饭馆就肚子疼一出饭馆就好了的病。 ​​​中国美妆博主和外国美妆博主的差别跟中国天气预报和外国天气预报的差别一样大。 ​​​以前在国外网站买东西，好多不送中国的，这些年买东西就从来没遇到过，每次都妥妥的送中国，而且一选中国，连省份都能列出来让你选，更夸张的是，连台湾的选项都没有了，然后一看，在中国选项里面有台湾省哈哈哈太会来事儿了。现在外国人对待中国人真的如他们所说，像对待财主一样了[允悲] ​​​新欢marmozets终于要出专辑了[太开心]英国有多久没出这种完颜团了[抓狂]太可爱了尤其鼓手怎么那么好看[舔屏][舔屏][舔屏] ​​​【音悦·视频】唤起回忆的时候到了！[小黄人高兴]回顾#A.N.JELL#在09年末的SBS演技大赏中带来的《原来是美男》经典OST《依然》，当时的大家都还是青涩的模样！[害羞]时间过得好快啊~依然 SBS演技大赏 现场版 09/12/31-张根硕 & A.N.JELL 高清MV-音悦台 ​​​一开始是做自己喜欢的事，为了快乐去做，因为有天赋，所以赚到了钱，然后为了挣更多钱，去迎合一些人，放弃一些自我，结果越是迎合，别人越是不买账甚至欺负你，然后不快乐，不快乐时做出的东西，自然也就不能赚钱了。还是得做自己，真的不能心软，所有的成功，不是因为你做的那些事，而是因为是你，所 ​​​ 全文
八心八箭发发发,3,这是谁配的音哈哈哈哈依萍听了想打人。[允悲][允悲] 神测子的秒拍视频 ​​​一天就写了两篇报道，我要疯了，正经事还没做呢。 ​​​30岁过了一个月了。 ​​​被穿坏的鞋。 ​​​快对翰哥脱粉了，《传奇大亨》真的一般。 ​​​【章子怡回应芭莎慈善夜扯衣漏肩拍照】针对慈善夜拉衣露肩拍照引发的争议，章子怡@稀土部队 作出了回应，表示那件衣服是她本人挑选：“衣服这样穿才好看，所以一听要合影，就把衣服拉下来了，当时其实没有想太多。” ​​​越想越生气，@小猴子的林胖胖，不回怼你几句，我心里真的气不过，在你眼里，娜扎红的登峰造极，红出宇宙，可在我眼里，娜扎距离红的标准还太远，你们是不是应该去查阅一下明星红的标准是什么再说话。我也想知道张翰为何需要捆绑她来宣传自己的电视剧，你说这话的时候，不怕风大，闪了你的大舌头吗  张 ​​​ 全文昨天老公和我生闷气，整整有八个小时都没和我好好讲话，睡觉前崩不住哭得上气不接下气，狂咳，留了一公斤的眼泪。睡觉前虽然又洗了脸，今天眼睛还是肿的。想到那个场景还是觉得心口疼。 ​​​追龙，这个名字在电影里只出现过一次。英文名更无厘头，叫chase the dragon ​​​@建设银行 去建设银行打2015年的银行流水单，被告知只能去开户行办理，且要10月12日后才能拿到结果。与此同时招商银行可以在任一网点办理，且当场就可以拿到盖章的流水单。 ​​​
wefkhdnxif,2,发布了头条文章：《让皮肤白皙紧绷的关键是什么？》 传言中可以美白的食物和方法有用吗？怎样紧致防皱？环境对皮肤的影响？最后小技巧分享 让皮肤白皙紧绷的关键是什么？ ​​​这几天真的心累，整的我明天只想抽一个原谅套装了，抱歉。东西我都准备好了，不想要也可以选择折现的，365刀按当日汇率。请救救月光女孩，以后会每月抽一样，又是小半年了呢。 ​​​发布了头条文章：《心理学公开课集》 心理学公开课集 ​​​王俊凯在访谈里被问到：女孩子的眼睛，嘴，鼻子，手，腿，头发你觉得哪里最好看最重要？他回：头发吧，长发。怪不得，我写的美发圣经，护发功课刚才被很多姑娘转发，请小凯粉丝看这里。关注W&X公主号：LastRomance八只梳子功课，二三十种洗发水功课，将近一万字的美发圣经，通通打包送给大噶。 ​​​ 全文#安利# 国学/历史向节目&纪录片推荐[电视]适用高中文科学习#语文##历史# 终于把这个史前巨坑填上了[鼓掌]只整理了很小的一部分 现在的好节目太多啦还有很多是我没有发现的 也欢迎大家在评论里给我推荐补充嗷！说明一下 有些适合课外涨姿势看 有些看了对于文科答题有帮助 想要提高成绩但又懒得去看很多 ​​​ 全文我决定再也不躲躲藏藏，勇敢过自己想要的生活，在此说出全部原委实情。 我－李格婷被家人虐打20年又被跟踪3年血泪史（始末详情） ​​​【努力工作的员工会让老板感动吗？】蒙德里安的微笑：「不会，只会感动自己，[摊手]该开除还是得开除。员工和老板之间是雇佣关系，维系这一关系的纽带是工资，努力工作的员工注重的不是怎么感动老板，而是要从公司的利益出发，想想自己能够为公司带来什么价值。」[向右]输入验证码 ​​​昨天GAI《凡人歌》这一段听了好多遍，忍不住剪出来分享：一往无前虎山行，拨开云雾见光明。梦里花开牡丹亭，幻象成真歌舞升平。 只关于篮球的微博视频 ​​​【如何保持正确的坐姿？】高科：「正确的坐姿依次是下巴和头收回落肩上，两侧肩胛骨向后收缩同时大臂稍微外旋让胸打开 ，同时肩胛骨下沉尽量让锁骨拉平成一条直线。脊椎拉直让上半身重心落坐骨上，腰腹保持一定程度的收紧来维持脊椎的姿势。双脚，双膝都冲正前方……」[向右]如何保持正确的坐姿？ ​​​《兰亭序》作词：方文山 作曲：周杰伦翻唱：我 & @永无乡de宁静 后期：@永无乡de宁静 海报：@雨田草心livriver 海报题字：@维以不永伤六义伊蒲塞椰砸壳 5sing 链接 兰亭序谢谢小维的题字！还有美美的海报，更要感谢小宁大大挽救了我的破音！！！欢迎收听！！！！！！[笑而不语] ​​​ 全文
睡不醒的米斯wen,2,别说，二十斤肥肉还是很保暖的，往常这个时候秋裤都穿了半个多月了。 ​​​有时候真心为自己的品味感到害怕，经常在小区里看到遛娃大妈跟我一样的优衣库同款。 ​​​中国有嘻哈决赛的表演一言难尽，但是投票真的太有意思了。 ​​​大头同学去伦敦给宝宝办护照，我一个人在家带他。跟爸妈视频的时候说了这事，我爸马上就很担心：“那你要自己给他换尿不湿？你会吗？”我心想：我都跨洋搬了两次家拿了两个学位给你找到了女婿生了个胖外孙，我能不会给他换尿不湿？当然我没这么说，只是简单回答：会。#话少生活就和睦# ​​​真不敢相信要去上班了，想躺着[狗]die ​​​宇宙行柜台不支持异地卡跨行转账？简直太服气了。 ​​​微博真是病的不轻，因为偶尔发照片所以隐私设置里允许微博使用手机相册里的照片，结果刚才刷新的时候发现微博自动读取了手机里最近拍的五张（六张？）照片，显示的仅自己可见，下头一个赶快发布的按键按了就可以一键发布了。知道你偷偷读取照片要不要这么明目张胆啊？ ​​​跟我爸我妈带着小丸子在外头吃饭。在我妈的提示下看到了那个小姑娘的背影，十三四岁的样子，高挑也挺洋气的。想一想，也十六年过去了。 ​​​小丸子真是傲娇的小公主。嗯，对。那你有没有当过公主？没有，我不想当公主。那你相当什么？主公。[doge][doge][doge][费解][费解][费解][二哈][二哈][二哈] ​​​对于该怎么让儿童学会与世界打交道的方式，我非常欣赏李娟在“牧场”系列中对于哈萨克牧民儿童游戏和劳动的描述。对于牧民的孩子来说，劳动就是游戏，游戏就是劳动，没有人去交给他们怎么做，他们自己暗中观察，并要求参与到这个活动当中去，自己体会其中况味。他做得好，大人不会特意夸奖；他搞砸了， ​​​ 全文
